match_id,year,city,date,player_of_match,venue,team1,team2,toss_winner,toss_decision,winner,result,result_margin,method,players,umpire1,umpire2,playoff,knockout,final
829725,2015,Pune,15-04-2015,MA Agarwal,Maharashtra Cricket Association Stadium,Kings XI Punjab,Delhi Daredevils,Kings XI Punjab,bat,Delhi Daredevils,wickets,5,,"M Vijay, V Sehwag, WP Saha, DA Miller, GJ Maxwell, GJ Bailey, AR Patel, R Dhawan, MG Johnson, Anureet Singh, Sandeep Sharma, MA Agarwal, SS Iyer, JP Duminy, Yuvraj Singh, AD Mathews, KM Jadhav, MK Tiwary, NM Coulter-Nile, A Mishra, Imran Tahir, DJ Muthuswami",CB Gaffaney,K Srinath,0,0,0
829727,2015,Visakhapatnam,16-04-2015,AM Rahane,Dr. Y.S. Rajasekhara Reddy ACA-VDCA Cricket Stadium,Sunrisers Hyderabad,Rajasthan Royals,Rajasthan Royals,field,Rajasthan Royals,wickets,6,,"DA Warner, S Dhawan, KL Rahul, NV Ojha, EJG Morgan, RS Bopara, A Ashish Reddy, KV Sharma, P Kumar, B Kumar, TA Boult, AM Rahane, SV Samson, SPD Smith, KK Nair, STR Binny, JP Faulkner, DJ Hooda, CH Morris, TG Southee, DS Kulkarni, PV Tambe",PG Pathak,S Ravi,0,0,0
829729,2015,Mumbai,17-04-2015,A Nehra,Wankhede Stadium,Mumbai Indians,Chennai Super Kings,Mumbai Indians,bat,Chennai Super Kings,wickets,6,,"LMP Simmons, PA Patel, CJ Anderson, RG Sharma, Harbhajan Singh, KA Pollard, AT Rayudu, J Suchith, R Vinay Kumar, SL Malinga, P Suyal, DR Smith, BB McCullum, SK Raina, F du Plessis, MS Dhoni, DJ Bravo, RA Jadeja, R Ashwin, MM Sharma, IC Pandey, A Nehra",AK Chaudhary,M Erasmus,0,0,0
829731,2015,Visakhapatnam,18-04-2015,JP Duminy,Dr. Y.S. Rajasekhara Reddy ACA-VDCA Cricket Stadium,Sunrisers Hyderabad,Delhi Daredevils,Delhi Daredevils,bat,Delhi Daredevils,runs,4,,"DA Warner, S Dhawan, RS Bopara, KL Rahul, NV Ojha, EJG Morgan, A Ashish Reddy, KV Sharma, P Kumar, B Kumar, DW Steyn, MA Agarwal, SS Iyer, JP Duminy, Yuvraj Singh, AD Mathews, KM Jadhav, MK Tiwary, NM Coulter-Nile, A Mishra, Imran Tahir, DJ Muthuswami",PG Pathak,S Ravi,0,0,0
829733,2015,Pune,18-04-2015,AD Russell,Maharashtra Cricket Association Stadium,Kings XI Punjab,Kolkata Knight Riders,Kolkata Knight Riders,field,Kolkata Knight Riders,wickets,4,,"M Vijay, V Sehwag, WP Saha, GJ Maxwell, GJ Bailey, NLTC Perera, Gurkeerat Singh, AR Patel, MG Johnson, Anureet Singh, Sandeep Sharma, RV Uthappa, G Gambhir, MK Pandey, SA Yadav, YK Pathan, RN ten Doeschate, AD Russell, PP Chawla, SP Narine, M Morkel, UT Yadav",SD Fry,CK Nandan,0,0,0
829735,2015,Ahmedabad,19-04-2015,AM Rahane,"Sardar Patel Stadium, Motera",Rajasthan Royals,Chennai Super Kings,Chennai Super Kings,bat,Rajasthan Royals,wickets,8,,"AM Rahane, SR Watson, SPD Smith, KK Nair, SV Samson, STR Binny, DJ Hooda, JP Faulkner, CH Morris, PV Tambe, Ankit Sharma, DR Smith, BB McCullum, SK Raina, F du Plessis, DJ Bravo, MS Dhoni, RA Jadeja, R Ashwin, MM Sharma, IC Pandey, A Nehra",AK Chaudhary,M Erasmus,0,0,0
829737,2015,Bangalore,19-04-2015,Harbhajan Singh,M Chinnaswamy Stadium,Royal Challengers Bangalore,Mumbai Indians,Royal Challengers Bangalore,field,Mumbai Indians,runs,18,,"CH Gayle, MS Bisla, V Kohli, KD Karthik, AB de Villiers, RR Rossouw, D Wiese, Iqbal Abdulla, AN Ahmed, VR Aaron, YS Chahal, LMP Simmons, PA Patel, UBT Chand, RG Sharma, KA Pollard, AT Rayudu, Harbhajan Singh, HH Pandya, JJ Bumrah, MJ McClenaghan, SL Malinga",RK Illingworth,VA Kulkarni,0,0,0
829739,2015,Delhi,20-04-2015,UT Yadav,Feroz Shah Kotla,Delhi Daredevils,Kolkata Knight Riders,Kolkata Knight Riders,field,Kolkata Knight Riders,wickets,6,,"MA Agarwal, SS Iyer, JP Duminy, MK Tiwary, Yuvraj Singh, AD Mathews, KM Jadhav, NM Coulter-Nile, A Mishra, Imran Tahir, DJ Muthuswami, RV Uthappa, G Gambhir, MK Pandey, SA Yadav, YK Pathan, RN ten Doeschate, AD Russell, PP Chawla, SP Narine, M Morkel, UT Yadav",SD Fry,CB Gaffaney,0,0,0
829741,2015,Ahmedabad,21-04-2015,SE Marsh,"Sardar Patel Stadium, Motera",Rajasthan Royals,Kings XI Punjab,Kings XI Punjab,field,,,,,"AM Rahane, SR Watson, DJ Hooda, SPD Smith, KK Nair, JP Faulkner, STR Binny, SV Samson, CH Morris, R Tewatia, PV Tambe, M Vijay, V Sehwag, SE Marsh, GJ Maxwell, DA Miller, WP Saha, AR Patel, MG Johnson, Anureet Singh, Shivam Sharma, Sandeep Sharma",M Erasmus,S Ravi,0,0,0
829743,2015,Visakhapatnam,22-04-2015,DA Warner,Dr. Y.S. Rajasekhara Reddy ACA-VDCA Cricket Stadium,Sunrisers Hyderabad,Kolkata Knight Riders,Kolkata Knight Riders,field,Sunrisers Hyderabad,runs,16,D/L,"S Dhawan, DA Warner, RS Bopara, NV Ojha, MC Henriques, KL Rahul, KV Sharma, Bipul Sharma, P Kumar, B Kumar, DW Steyn, RV Uthappa, G Gambhir, MK Pandey, AD Russell, YK Pathan, SA Yadav, J Botha, PP Chawla, SP Narine, M Morkel, UT Yadav",RK Illingworth,VA Kulkarni,0,0,0
829745,2015,Bangalore,22-04-2015,SK Raina,M Chinnaswamy Stadium,Royal Challengers Bangalore,Chennai Super Kings,Royal Challengers Bangalore,field,Chennai Super Kings,runs,27,,"MS Bisla, RR Rossouw, V Kohli, KD Karthik, AB de Villiers, SN Khan, D Wiese, HV Patel, MA Starc, Iqbal Abdulla, YS Chahal, DR Smith, BB McCullum, SK Raina, MS Dhoni, RA Jadeja, F du Plessis, DJ Bravo, R Ashwin, MM Sharma, A Nehra, IC Pandey",JD Cloete,C Shamshuddin,0,0,0
829747,2015,Delhi,23-04-2015,SS Iyer,Feroz Shah Kotla,Delhi Daredevils,Mumbai Indians,Mumbai Indians,field,Delhi Daredevils,runs,37,,"MA Agarwal, SS Iyer, JP Duminy, AD Mathews, Yuvraj Singh, KM Jadhav, NM Coulter-Nile, A Mishra, S Nadeem, Imran Tahir, DJ Muthuswami, LMP Simmons, PA Patel, UBT Chand, RG Sharma, KA Pollard, AT Rayudu, HH Pandya, Harbhajan Singh, MJ McClenaghan, SL Malinga, JJ Bumrah",SD Fry,CK Nandan,0,0,0
829749,2015,Ahmedabad,24-04-2015,MA Starc,"Sardar Patel Stadium, Motera",Rajasthan Royals,Royal Challengers Bangalore,Royal Challengers Bangalore,field,Royal Challengers Bangalore,wickets,9,,"AM Rahane, SR Watson, SPD Smith, KK Nair, DJ Hooda, SV Samson, STR Binny, JP Faulkner, CH Morris, DS Kulkarni, PV Tambe, CH Gayle, V Kohli, AB de Villiers, Mandeep Singh, KD Karthik, SN Khan, D Wiese, HV Patel, MA Starc, Iqbal Abdulla, YS Chahal",M Erasmus,S Ravi,0,0,0
829751,2015,Mumbai,25-04-2015,SL Malinga,Wankhede Stadium,Mumbai Indians,Sunrisers Hyderabad,Mumbai Indians,bat,Mumbai Indians,runs,20,,"LMP Simmons, PA Patel, UBT Chand, RG Sharma, KA Pollard, AT Rayudu, Harbhajan Singh, J Suchith, R Vinay Kumar, MJ McClenaghan, SL Malinga, S Dhawan, DA Warner, KL Rahul, NV Ojha, RS Bopara, GH Vihari, KV Sharma, P Kumar, DW Steyn, B Kumar, TA Boult",HDPK Dharmasena,CB Gaffaney,0,0,0
829753,2015,Chennai,25-04-2015,BB McCullum,"MA Chidambaram Stadium, Chepauk",Chennai Super Kings,Kings XI Punjab,Chennai Super Kings,bat,Chennai Super Kings,runs,97,,"DR Smith, BB McCullum, SK Raina, MS Dhoni, RA Jadeja, F du Plessis, DJ Bravo, R Ashwin, MM Sharma, IC Pandey, A Nehra, M Vijay, V Sehwag, SE Marsh, GJ Bailey, DA Miller, WP Saha, AR Patel, MG Johnson, Anureet Singh, Karanveer Singh, Sandeep Sharma",JD Cloete,C Shamshuddin,0,0,0
829755,2015,Kolkata,26-04-2015,,Eden Gardens,Kolkata Knight Riders,Rajasthan Royals,,,,,,,,Rajesh Deshpande,Richard Illingworth,0,0,0
829757,2015,Delhi,26-04-2015,VR Aaron,Feroz Shah Kotla,Delhi Daredevils,Royal Challengers Bangalore,Royal Challengers Bangalore,field,Royal Challengers Bangalore,wickets,10,,"MA Agarwal, SS Iyer, JP Duminy, Yuvraj Singh, AD Mathews, KM Jadhav, NM Coulter-Nile, A Mishra, S Nadeem, Imran Tahir, DJ Muthuswami, CH Gayle, V Kohli, AB de Villiers, Mandeep Singh, KD Karthik, SN Khan, D Wiese, HV Patel, MA Starc, Iqbal Abdulla, VR Aaron",M Erasmus,S Ravi,0,0,0
829759,2015,Chandigarh,27-04-2015,TA Boult,"Punjab Cricket Association Stadium, Mohali",Kings XI Punjab,Sunrisers Hyderabad,Kings XI Punjab,field,Sunrisers Hyderabad,runs,20,,"M Vijay, M Vohra, SE Marsh, GJ Bailey, DA Miller, WP Saha, AR Patel, R Dhawan, MG Johnson, Anureet Singh, Sandeep Sharma, DA Warner, S Dhawan, GH Vihari, MC Henriques, NV Ojha, RS Bopara, A Ashish Reddy, KV Sharma, P Kumar, B Kumar, TA Boult",HDPK Dharmasena,CB Gaffaney,0,0,0
829761,2015,Kolkata,07-05-2015,PP Chawla,Eden Gardens,Kolkata Knight Riders,Delhi Daredevils,Kolkata Knight Riders,bat,Kolkata Knight Riders,runs,13,,"RV Uthappa, G Gambhir, MK Pandey, PP Chawla, YK Pathan, AD Russell, SA Yadav, J Botha, GB Hogg, UT Yadav, SP Narine, MK Tiwary, SS Iyer, JP Duminy, KM Jadhav, Yuvraj Singh, AD Mathews, SS Tiwary, JA Morkel, A Mishra, Imran Tahir, Z Khan",AK Chaudhary,M Erasmus,0,0,0
829763,2015,Bangalore,29-04-2015,,M Chinnaswamy Stadium,Royal Challengers Bangalore,Rajasthan Royals,Rajasthan Royals,field,,,,,"CH Gayle, V Kohli, AB de Villiers, Mandeep Singh, KD Karthik, SN Khan, D Wiese, HV Patel, MA Starc, VR Aaron, YS Chahal, AM Rahane, SR Watson, SPD Smith, KK Nair, SV Samson, STR Binny, DJ Hooda, JP Faulkner, PV Tambe, DS Kulkarni, TG Southee",JD Cloete,PG Pathak,0,0,0
829765,2015,Chennai,28-04-2015,DJ Bravo,"MA Chidambaram Stadium, Chepauk",Chennai Super Kings,Kolkata Knight Riders,Kolkata Knight Riders,field,Chennai Super Kings,runs,2,,"DR Smith, BB McCullum, SK Raina, F du Plessis, MS Dhoni, DJ Bravo, RA Jadeja, R Ashwin, MM Sharma, IC Pandey, A Nehra, RV Uthappa, G Gambhir, MK Pandey, SA Yadav, YK Pathan, RN ten Doeschate, AD Russell, PJ Cummins, PP Chawla, UT Yadav, GB Hogg",RM Deshpande,VA Kulkarni,0,0,0
829767,2015,Delhi,01-05-2015,NM Coulter-Nile,Feroz Shah Kotla,Delhi Daredevils,Kings XI Punjab,Delhi Daredevils,field,Delhi Daredevils,wickets,9,,"MA Agarwal, SS Iyer, SS Tiwary, JP Duminy, Yuvraj Singh, AD Mathews, KM Jadhav, NM Coulter-Nile, A Mishra, Z Khan, Imran Tahir, V Sehwag, M Vohra, SE Marsh, WP Saha, DA Miller, GJ Bailey, NLTC Perera, AR Patel, SN Thakur, Anureet Singh, Sandeep Sharma",RK Illingworth,S Ravi,0,0,0
829769,2015,Mumbai,01-05-2015,AT Rayudu,Wankhede Stadium,Mumbai Indians,Rajasthan Royals,Rajasthan Royals,field,Mumbai Indians,runs,8,,"LMP Simmons, PA Patel, UBT Chand, RG Sharma, AT Rayudu, KA Pollard, Harbhajan Singh, J Suchith, R Vinay Kumar, MJ McClenaghan, SL Malinga, AM Rahane, SR Watson, SV Samson, SPD Smith, KK Nair, STR Binny, DJ Hooda, TG Southee, J Theron, DS Kulkarni, Ankit Sharma",HDPK Dharmasena,CK Nandan,0,0,0
829771,2015,Bangalore,02-05-2015,Mandeep Singh,M Chinnaswamy Stadium,Royal Challengers Bangalore,Kolkata Knight Riders,Royal Challengers Bangalore,field,Royal Challengers Bangalore,wickets,7,,"CH Gayle, V Kohli, AB de Villiers, Mandeep Singh, D Wiese, KD Karthik, SN Khan, HV Patel, MA Starc, VR Aaron, YS Chahal, RV Uthappa, G Gambhir, AD Russell, RN ten Doeschate, YK Pathan, SA Yadav, MK Pandey, PJ Cummins, PP Chawla, GB Hogg, UT Yadav",JD Cloete,PG Pathak,0,0,0
829773,2015,Hyderabad,02-05-2015,DA Warner,"Rajiv Gandhi International Stadium, Uppal",Sunrisers Hyderabad,Chennai Super Kings,Chennai Super Kings,field,Sunrisers Hyderabad,runs,22,,"DA Warner, S Dhawan, MC Henriques, EJG Morgan, NV Ojha, A Ashish Reddy, GH Vihari, KV Sharma, B Kumar, P Kumar, TA Boult, DR Smith, BB McCullum, SK Raina, F du Plessis, MS Dhoni, P Negi, DJ Bravo, RA Jadeja, MM Sharma, A Nehra, RG More",AK Chaudhary,K Srinivasan,0,0,0
829775,2015,Chandigarh,03-05-2015,LMP Simmons,"Punjab Cricket Association Stadium, Mohali",Kings XI Punjab,Mumbai Indians,Mumbai Indians,bat,Mumbai Indians,runs,23,,"M Vijay, V Sehwag, GJ Maxwell, DA Miller, GJ Bailey, WP Saha, AR Patel, MG Johnson, Anureet Singh, Sandeep Sharma, Karanveer Singh, LMP Simmons, PA Patel, RG Sharma, KA Pollard, AT Rayudu, UBT Chand, Harbhajan Singh, J Suchith, R Vinay Kumar, MJ McClenaghan, SL Malinga",RK Illingworth,VA Kulkarni,0,0,0
829777,2015,Mumbai,03-05-2015,AM Rahane,Brabourne Stadium,Rajasthan Royals,Delhi Daredevils,Delhi Daredevils,field,Rajasthan Royals,runs,14,,"AM Rahane, SR Watson, KK Nair, JP Faulkner, SPD Smith, SV Samson, STR Binny, DJ Hooda, TG Southee, DS Kulkarni, R Bhatia, MA Agarwal, SS Iyer, JP Duminy, Yuvraj Singh, AD Mathews, KM Jadhav, SS Tiwary, NM Coulter-Nile, A Mishra, Z Khan, GS Sandhu",HDPK Dharmasena,CB Gaffaney,0,0,0
829779,2015,Chennai,04-05-2015,SK Raina,"MA Chidambaram Stadium, Chepauk",Chennai Super Kings,Royal Challengers Bangalore,Chennai Super Kings,bat,Chennai Super Kings,runs,24,,"DR Smith, BB McCullum, SK Raina, F du Plessis, MS Dhoni, RA Jadeja, P Negi, DJ Bravo, MM Sharma, A Nehra, IC Pandey, NJ Maddinson, V Kohli, AB de Villiers, Mandeep Singh, KD Karthik, SN Khan, D Wiese, HV Patel, MA Starc, Iqbal Abdulla, YS Chahal",C Shamshuddin,K Srinath,0,0,0
829781,2015,Kolkata,04-05-2015,UT Yadav,Eden Gardens,Kolkata Knight Riders,Sunrisers Hyderabad,Sunrisers Hyderabad,field,Kolkata Knight Riders,runs,35,,"RV Uthappa, G Gambhir, MK Pandey, AD Russell, RN ten Doeschate, YK Pathan, J Botha, SA Yadav, PP Chawla, GB Hogg, UT Yadav, DA Warner, S Dhawan, NV Ojha, MC Henriques, EJG Morgan, GH Vihari, Bipul Sharma, KV Sharma, P Kumar, B Kumar, DW Steyn",AK Chaudhary,M Erasmus,0,0,0
829783,2015,Mumbai,05-05-2015,Harbhajan Singh,Wankhede Stadium,Mumbai Indians,Delhi Daredevils,Delhi Daredevils,bat,Mumbai Indians,wickets,5,,"LMP Simmons, PA Patel, HH Pandya, RG Sharma, Harbhajan Singh, AT Rayudu, KA Pollard, J Suchith, R Vinay Kumar, MJ McClenaghan, SL Malinga, MA Agarwal, SS Iyer, JP Duminy, KM Jadhav, Yuvraj Singh, AD Mathews, SS Tiwary, NM Coulter-Nile, A Mishra, Imran Tahir, Z Khan",HDPK Dharmasena,CB Gaffaney,0,0,0
829785,2015,Bangalore,06-05-2015,CH Gayle,M Chinnaswamy Stadium,Royal Challengers Bangalore,Kings XI Punjab,Kings XI Punjab,field,Royal Challengers Bangalore,runs,138,,"CH Gayle, V Kohli, AB de Villiers, KD Karthik, SN Khan, Mandeep Singh, D Wiese, MA Starc, HV Patel, YS Chahal, S Aravind, M Vijay, M Vohra, WP Saha, GJ Maxwell, DA Miller, GJ Bailey, AR Patel, MG Johnson, Anureet Singh, Karanveer Singh, Sandeep Sharma",RK Illingworth,VA Kulkarni,0,0,0
829787,2015,Mumbai,07-05-2015,EJG Morgan,Brabourne Stadium,Rajasthan Royals,Sunrisers Hyderabad,Rajasthan Royals,field,Sunrisers Hyderabad,runs,7,,"AM Rahane, SR Watson, SPD Smith, KK Nair, DJ Hooda, JP Faulkner, SV Samson, STR Binny, CH Morris, DS Kulkarni, PV Tambe, S Dhawan, DA Warner, MC Henriques, EJG Morgan, RS Bopara, NV Ojha, GH Vihari, KV Sharma, P Kumar, B Kumar, I Sharma",JD Cloete,C Shamshuddin,0,0,0
829789,2015,Chennai,08-05-2015,HH Pandya,"MA Chidambaram Stadium, Chepauk",Chennai Super Kings,Mumbai Indians,Chennai Super Kings,bat,Mumbai Indians,wickets,6,,"DR Smith, BB McCullum, SK Raina, F du Plessis, MS Dhoni, P Negi, RA Jadeja, DJ Bravo, R Ashwin, MM Sharma, A Nehra, LMP Simmons, PA Patel, RG Sharma, KA Pollard, AT Rayudu, HH Pandya, Harbhajan Singh, J Suchith, R Vinay Kumar, MJ McClenaghan, M de Lange",CB Gaffaney,CK Nandan,0,0,0
829791,2015,Kolkata,09-05-2015,AD Russell,Eden Gardens,Kolkata Knight Riders,Kings XI Punjab,Kings XI Punjab,bat,Kolkata Knight Riders,wickets,1,,"RV Uthappa, G Gambhir, MK Pandey, SA Yadav, YK Pathan, AD Russell, J Botha, PP Chawla, GB Hogg, UT Yadav, SP Narine, M Vijay, M Vohra, WP Saha, GJ Maxwell, DA Miller, Gurkeerat Singh, GJ Bailey, AR Patel, BE Hendricks, Anureet Singh, Sandeep Sharma",AK Chaudhary,HDPK Dharmasena,0,0,0
829793,2015,Raipur,09-05-2015,MC Henriques,Shaheed Veer Narayan Singh International Stadium,Delhi Daredevils,Sunrisers Hyderabad,Sunrisers Hyderabad,bat,Sunrisers Hyderabad,runs,6,,"Q de Kock, SS Iyer, JP Duminy, Yuvraj Singh, KM Jadhav, SS Tiwary, JA Morkel, J Yadav, NM Coulter-Nile, A Mishra, Z Khan, S Dhawan, DA Warner, MC Henriques, EJG Morgan, KV Sharma, RS Bopara, NV Ojha, Parvez Rasool, P Kumar, B Kumar, I Sharma",VA Kulkarni,S Ravi,0,0,0
829795,2015,Mumbai,10-05-2015,AB de Villiers,Wankhede Stadium,Mumbai Indians,Royal Challengers Bangalore,Royal Challengers Bangalore,bat,Royal Challengers Bangalore,runs,39,,"PA Patel, LMP Simmons, RG Sharma, KA Pollard, HH Pandya, AT Rayudu, Harbhajan Singh, J Suchith, MJ McClenaghan, SL Malinga, JJ Bumrah, CH Gayle, V Kohli, AB de Villiers, KD Karthik, SN Khan, Mandeep Singh, D Wiese, MA Starc, HV Patel, YS Chahal, S Aravind",JD Cloete,C Shamshuddin,0,0,0
829797,2015,Chennai,10-05-2015,RA Jadeja,"MA Chidambaram Stadium, Chepauk",Chennai Super Kings,Rajasthan Royals,Chennai Super Kings,bat,Chennai Super Kings,runs,12,,"DR Smith, BB McCullum, SK Raina, F du Plessis, P Negi, MS Dhoni, DJ Bravo, RA Jadeja, R Ashwin, MM Sharma, A Nehra, AM Rahane, SR Watson, SPD Smith, KK Nair, DJ Hooda, SV Samson, JP Faulkner, CH Morris, R Bhatia, Ankit Sharma, PV Tambe",M Erasmus,CK Nandan,0,0,0
829799,2015,Hyderabad,11-05-2015,DA Warner,"Rajiv Gandhi International Stadium, Uppal",Sunrisers Hyderabad,Kings XI Punjab,Sunrisers Hyderabad,bat,Sunrisers Hyderabad,runs,5,,"DA Warner, S Dhawan, MC Henriques, EJG Morgan, NV Ojha, KL Rahul, KV Sharma, Bipul Sharma, B Kumar, TA Boult, I Sharma, M Vijay, M Vohra, WP Saha, GJ Maxwell, DA Miller, GJ Bailey, Gurkeerat Singh, AR Patel, BE Hendricks, Anureet Singh, Sandeep Sharma",AK Chaudhary,HDPK Dharmasena,0,0,0
829801,2015,Raipur,12-05-2015,Z Khan,Shaheed Veer Narayan Singh International Stadium,Delhi Daredevils,Chennai Super Kings,Chennai Super Kings,bat,Delhi Daredevils,wickets,6,,"Q de Kock, SS Iyer, JP Duminy, Yuvraj Singh, JA Morkel, KM Jadhav, SS Tiwary, J Yadav, GS Sandhu, Z Khan, S Nadeem, DR Smith, BB McCullum, SK Raina, F du Plessis, MS Dhoni, DJ Bravo, P Negi, RA Jadeja, R Ashwin, MM Sharma, IC Pandey",RK Illingworth,VA Kulkarni,0,0,0
829803,2015,Chandigarh,13-05-2015,AR Patel,"Punjab Cricket Association Stadium, Mohali",Kings XI Punjab,Royal Challengers Bangalore,Royal Challengers Bangalore,field,Kings XI Punjab,runs,22,,"WP Saha, M Vohra, GJ Maxwell, DA Miller, GJ Bailey, AR Patel, Gurkeerat Singh, R Dhawan, BE Hendricks, Anureet Singh, Sandeep Sharma, CH Gayle, V Kohli, AB de Villiers, Mandeep Singh, KD Karthik, SN Khan, D Wiese, HV Patel, MA Starc, YS Chahal, S Aravind",JD Cloete,C Shamshuddin,0,0,0
829805,2015,Mumbai,14-05-2015,HH Pandya,Wankhede Stadium,Mumbai Indians,Kolkata Knight Riders,Kolkata Knight Riders,field,Mumbai Indians,runs,5,,"LMP Simmons, PA Patel, RG Sharma, AT Rayudu, KA Pollard, HH Pandya, Harbhajan Singh, J Suchith, MJ McClenaghan, R Vinay Kumar, SL Malinga, RV Uthappa, G Gambhir, MK Pandey, YK Pathan, Shakib Al Hasan, AD Russell, SA Yadav, PP Chawla, UT Yadav, M Morkel, SP Narine",RK Illingworth,VA Kulkarni,0,0,0
829807,2015,Hyderabad,15-05-2015,V Kohli,"Rajiv Gandhi International Stadium, Uppal",Sunrisers Hyderabad,Royal Challengers Bangalore,Sunrisers Hyderabad,bat,Royal Challengers Bangalore,wickets,6,D/L,"DA Warner, S Dhawan, MC Henriques, EJG Morgan, NV Ojha, KL Rahul, Bipul Sharma, KV Sharma, B Kumar, P Kumar, DW Steyn, CH Gayle, V Kohli, AB de Villiers, Mandeep Singh, KD Karthik, SN Khan, D Wiese, MA Starc, HV Patel, YS Chahal, AB Dinda",AK Chaudhary,HDPK Dharmasena,0,0,0
829809,2015,Chandigarh,16-05-2015,P Negi,"Punjab Cricket Association Stadium, Mohali",Kings XI Punjab,Chennai Super Kings,Kings XI Punjab,bat,Chennai Super Kings,wickets,7,,"WP Saha, M Vohra, GJ Bailey, GJ Maxwell, Gurkeerat Singh, DA Miller, AR Patel, R Dhawan, BE Hendricks, Anureet Singh, Sandeep Sharma, MEK Hussey, BB McCullum, F du Plessis, SK Raina, MS Dhoni, DJ Bravo, P Negi, RA Jadeja, R Ashwin, A Nehra, IC Pandey",CK Nandan,C Shamshuddin,0,0,0
829811,2015,Mumbai,16-05-2015,SR Watson,Brabourne Stadium,Rajasthan Royals,Kolkata Knight Riders,Rajasthan Royals,bat,Rajasthan Royals,runs,9,,"AM Rahane, SR Watson, SPD Smith, SV Samson, JP Faulkner, KK Nair, CH Morris, DJ Hooda, STR Binny, DS Kulkarni, BB Sran, RV Uthappa, G Gambhir, MK Pandey, YK Pathan, AD Russell, SA Yadav, Shakib Al Hasan, Azhar Mahmood, PP Chawla, UT Yadav, M Morkel",RM Deshpande,RK Illingworth,0,0,0
829813,2015,Bangalore,17-05-2015,,M Chinnaswamy Stadium,Royal Challengers Bangalore,Delhi Daredevils,Royal Challengers Bangalore,field,,,,,"V Kohli, CH Gayle, AB de Villiers, Mandeep Singh, KD Karthik, SN Khan, D Wiese, MA Starc, HV Patel, YS Chahal, AB Dinda, Q de Kock, SS Iyer, JP Duminy, Yuvraj Singh, KM Jadhav, AD Mathews, SS Tiwary, J Yadav, S Nadeem, GS Sandhu, Z Khan",HDPK Dharmasena,K Srinivasan,0,0,0
829815,2015,Hyderabad,17-05-2015,MJ McClenaghan,"Rajiv Gandhi International Stadium, Uppal",Sunrisers Hyderabad,Mumbai Indians,Sunrisers Hyderabad,bat,Mumbai Indians,wickets,9,,"DA Warner, S Dhawan, MC Henriques, EJG Morgan, KL Rahul, NV Ojha, KV Sharma, A Ashish Reddy, B Kumar, P Kumar, DW Steyn, LMP Simmons, PA Patel, RG Sharma, AT Rayudu, KA Pollard, HH Pandya, Harbhajan Singh, J Suchith, MJ McClenaghan, R Vinay Kumar, SL Malinga",CB Gaffaney,K Srinath,0,0,0
829817,2015,Mumbai,19-05-2015,KA Pollard,Wankhede Stadium,Chennai Super Kings,Mumbai Indians,Mumbai Indians,bat,Mumbai Indians,runs,25,,"DR Smith, MEK Hussey, F du Plessis, SK Raina, MS Dhoni, DJ Bravo, RA Jadeja, P Negi, R Ashwin, MM Sharma, A Nehra, LMP Simmons, PA Patel, RG Sharma, KA Pollard, HH Pandya, AT Rayudu, Harbhajan Singh, J Suchith, MJ McClenaghan, R Vinay Kumar, SL Malinga",HDPK Dharmasena,RK Illingworth,1,0,0
829819,2015,Pune,20-05-2015,AB de Villiers,Maharashtra Cricket Association Stadium,Royal Challengers Bangalore,Rajasthan Royals,Royal Challengers Bangalore,bat,Royal Challengers Bangalore,runs,71,,"CH Gayle, V Kohli, AB de Villiers, Mandeep Singh, KD Karthik, SN Khan, D Wiese, MA Starc, HV Patel, YS Chahal, S Aravind, AM Rahane, SR Watson, SV Samson, SPD Smith, KK Nair, DJ Hooda, JP Faulkner, STR Binny, CH Morris, Ankit Sharma, DS Kulkarni",AK Chaudhary,C Shamshuddin,1,1,0
829821,2015,Ranchi,22-05-2015,A Nehra,JSCA International Stadium Complex,Chennai Super Kings,Royal Challengers Bangalore,Chennai Super Kings,field,Chennai Super Kings,wickets,3,,"DR Smith, MEK Hussey, F du Plessis, SK Raina, MS Dhoni, P Negi, DJ Bravo, RA Jadeja, R Ashwin, MM Sharma, A Nehra, CH Gayle, V Kohli, AB de Villiers, Mandeep Singh, KD Karthik, SN Khan, D Wiese, HV Patel, MA Starc, S Aravind, YS Chahal",AK Chaudhary,CB Gaffaney,1,1,0
829823,2015,Kolkata,24-05-2015,RG Sharma,Eden Gardens,Mumbai Indians,Chennai Super Kings,Chennai Super Kings,field,Mumbai Indians,runs,41,,"LMP Simmons, PA Patel, RG Sharma, KA Pollard, AT Rayudu, HH Pandya, Harbhajan Singh, J Suchith, MJ McClenaghan, R Vinay Kumar, SL Malinga, DR Smith, MEK Hussey, SK Raina, MS Dhoni, DJ Bravo, P Negi, F du Plessis, RA Jadeja, R Ashwin, MM Sharma, A Nehra",HDPK Dharmasena,RK Illingworth,1,1,1
980901,2016,Mumbai,09-04-2016,AM Rahane,Wankhede Stadium,Mumbai Indians,Rising Pune Supergiants,Mumbai Indians,bat,Rising Pune Supergiants,wickets,9,,"LMP Simmons, RG Sharma, HH Pandya, JC Buttler, AT Rayudu, KA Pollard, S Gopal, Harbhajan Singh, R Vinay Kumar, MJ McClenaghan, JJ Bumrah, AM Rahane, F du Plessis, KP Pietersen, MS Dhoni, SPD Smith, R Bhatia, MR Marsh, R Ashwin, I Sharma, M Ashwin, RP Singh",HDPK Dharmasena,CK Nandan,0,0,0
980903,2016,Kolkata,10-04-2016,AD Russell,Eden Gardens,Kolkata Knight Riders,Delhi Daredevils,Kolkata Knight Riders,field,Kolkata Knight Riders,wickets,9,,"RV Uthappa, G Gambhir, MK Pandey, C Munro, SA Yadav, YK Pathan, AD Russell, PP Chawla, JW Hastings, GB Hogg, UT Yadav, MA Agarwal, Q de Kock, SS Iyer, KK Nair, SV Samson, P Negi, CR Brathwaite, CH Morris, NM Coulter-Nile, A Mishra, Z Khan",S Ravi,C Shamshuddin,0,0,0
980905,2016,Chandigarh,11-04-2016,AJ Finch,"Punjab Cricket Association IS Bindra Stadium, Mohali",Kings XI Punjab,Gujarat Lions,Gujarat Lions,field,Gujarat Lions,wickets,5,,"M Vijay, M Vohra, DA Miller, GJ Maxwell, WP Saha, MP Stoinis, AR Patel, MG Johnson, P Sahu, MM Sharma, Sandeep Sharma, AJ Finch, BB McCullum, SK Raina, KD Karthik, RA Jadeja, Ishan Kishan, DJ Bravo, JP Faulkner, P Kumar, PJ Sangwan, S Ladda",AK Chaudhary,VA Kulkarni,0,0,0
980907,2016,Bangalore,12-04-2016,AB de Villiers,M Chinnaswamy Stadium,Royal Challengers Bangalore,Sunrisers Hyderabad,Sunrisers Hyderabad,field,Royal Challengers Bangalore,runs,45,,"CH Gayle, V Kohli, AB de Villiers, SR Watson, SN Khan, KM Jadhav, STR Binny, Parvez Rasool, HV Patel, AF Milne, YS Chahal, DA Warner, S Dhawan, MC Henriques, NV Ojha, DJ Hooda, EJG Morgan, A Ashish Reddy, KV Sharma, A Nehra, B Kumar, Mustafizur Rahman",HDPK Dharmasena,VK Sharma,0,0,0
980909,2016,Kolkata,13-04-2016,RG Sharma,Eden Gardens,Kolkata Knight Riders,Mumbai Indians,Mumbai Indians,field,Mumbai Indians,wickets,6,,"RV Uthappa, G Gambhir, MK Pandey, AD Russell, YK Pathan, C Munro, SA Yadav, PP Chawla, JW Hastings, Kuldeep Yadav, GB Hogg, RG Sharma, PA Patel, HH Pandya, MJ McClenaghan, JC Buttler, KA Pollard, AT Rayudu, Harbhajan Singh, J Suchith, TG Southee, JJ Bumrah",Nitin Menon,S Ravi,0,0,0
980911,2016,Rajkot,14-04-2016,AJ Finch,Saurashtra Cricket Association Stadium,Gujarat Lions,Rising Pune Supergiants,Rising Pune Supergiants,bat,Gujarat Lions,wickets,7,,"AJ Finch, BB McCullum, SK Raina, DJ Bravo, RA Jadeja, KD Karthik, AD Nath, JP Faulkner, P Kumar, SB Jakati, PV Tambe, AM Rahane, F du Plessis, KP Pietersen, SPD Smith, MS Dhoni, MR Marsh, R Bhatia, R Ashwin, I Sharma, RP Singh, M Ashwin",VA Kulkarni,CK Nandan,0,0,0
980913,2016,Delhi,15-04-2016,A Mishra,Feroz Shah Kotla,Delhi Daredevils,Kings XI Punjab,Delhi Daredevils,field,Delhi Daredevils,wickets,8,,"Q de Kock, SS Iyer, SV Samson, P Negi, KK Nair, JP Duminy, CR Brathwaite, J Yadav, CH Morris, Z Khan, A Mishra, M Vijay, M Vohra, SE Marsh, DA Miller, GJ Maxwell, AR Patel, WP Saha, MG Johnson, MM Sharma, P Sahu, Sandeep Sharma",S Ravi,C Shamshuddin,0,0,0
980915,2016,Hyderabad,16-04-2016,G Gambhir,"Rajiv Gandhi International Stadium, Uppal",Sunrisers Hyderabad,Kolkata Knight Riders,Sunrisers Hyderabad,bat,Kolkata Knight Riders,wickets,8,,"DA Warner, S Dhawan, MC Henriques, EJG Morgan, DJ Hooda, NV Ojha, A Ashish Reddy, KV Sharma, B Kumar, Mustafizur Rahman, BB Sran, RV Uthappa, G Gambhir, AD Russell, MK Pandey, Shakib Al Hasan, YK Pathan, SA Yadav, PP Chawla, SP Narine, M Morkel, UT Yadav",AK Chaudhary,CK Nandan,0,0,0
980917,2016,Mumbai,16-04-2016,AJ Finch,Wankhede Stadium,Mumbai Indians,Gujarat Lions,Gujarat Lions,field,Gujarat Lions,wickets,3,,"RG Sharma, PA Patel, HH Pandya, JC Buttler, KA Pollard, AT Rayudu, Harbhajan Singh, KH Pandya, TG Southee, MJ McClenaghan, JJ Bumrah, AJ Finch, BB McCullum, SK Raina, KD Karthik, DJ Bravo, AD Nath, JP Faulkner, P Kumar, DS Kulkarni, SB Jakati, PV Tambe",HDPK Dharmasena,VK Sharma,0,0,0
