match_id,year,city,date,player_of_match,venue,team1,team2,toss_winner,toss_decision,winner,result,result_margin,method,players,umpire1,umpire2,playoff,knockout,final
501258,2011,Indore,15-05-2011,BJ Hodge,Holkar Cricket Stadium,Kochi Tuskers Kerala,Rajasthan Royals,Kochi Tuskers Kerala,field,Kochi Tuskers Kerala,wickets,8,,"BB McCullum, DPMD Jayawardene, PA Patel, BJ Hodge, OA Shah, RA Jadeja, RP Singh, P Parameswaran, P Prasanth, S Sreesanth, Y Gnaneswara Rao, FY Fazal, R Dravid, SR Watson, AM Rahane, AL Menaria, PR Shah, JDP Oram, SK Warne, AA Chavan, SW Tait, ND Doshi",PR Reiffel,RJ Tucker,0,0,0
501259,2011,Mumbai,16-05-2011,A Mishra,Dr DY Patil Sports Academy,Pune Warriors,Deccan Chargers,Deccan Chargers,field,Deccan Chargers,wickets,6,,"JD Ryder, MK Pandey, SC Ganguly, RV Uthappa, Yuvraj Singh, M Manhas, CJ Ferguson, MR Marsh, WD Parnell, B Kumar, R Sharma, S Sohal, S Dhawan, KC Sangakkara, JP Duminy, DT Christian, B Chipli, DB Ravi Teja, PP Ojha, A Mishra, I Sharma, DW Steyn",S Ravi,SK Tarapore,0,0,0
501260,2011,Dharamsala,17-05-2011,AC Gilchrist,Himachal Pradesh Cricket Association Stadium,Kings XI Punjab,Royal Challengers Bangalore,Kings XI Punjab,bat,Kings XI Punjab,runs,111,,"PC Valthaty, AC Gilchrist, SE Marsh, DJ Hussey, KD Karthik, Mandeep Singh, AM Nayar, SJ Srivastava, PP Chawla, P Kumar, RJ Harris, CH Gayle, SS Tiwary, V Kohli, AB de Villiers, AUK Pathan, M Kaif, KB Arun Karthik, JJ van der Wath, A Mithun, CK Langeveldt, S Aravind",Asad Rauf,AM Saheba,0,0,0
501261,2011,Chennai,18-05-2011,WP Saha,"MA Chidambaram Stadium, Chepauk",Chennai Super Kings,Kochi Tuskers Kerala,Chennai Super Kings,bat,Chennai Super Kings,runs,11,,"MEK Hussey, M Vijay, SK Raina, S Badrinath, WP Saha, MS Dhoni, JA Morkel, DJ Bravo, R Ashwin, DE Bollinger, SB Jakati, PA Patel, BB McCullum, Y Gnaneswara Rao, BJ Hodge, RA Jadeja, OA Shah, KM Jadhav, R Vinay Kumar, M Muralitharan, RP Singh, S Sreesanth",HDPK Dharmasena,RE Koertzen,0,0,0
501262,2011,Mumbai,19-05-2011,YK Pathan,Dr DY Patil Sports Academy,Pune Warriors,Kolkata Knight Riders,Kolkata Knight Riders,field,Kolkata Knight Riders,wickets,7,,"JD Ryder, MK Pandey, CJ Ferguson, SC Ganguly, RV Uthappa, Yuvraj Singh, S Rana, WD Parnell, AC Thomas, R Sharma, B Kumar, G Gambhir, SP Goswami, MK Tiwary, YK Pathan, R Bhatia, JH Kallis, RN ten Doeschate, Shakib Al Hasan, B Lee, L Balaji, Iqbal Abdulla",S Ravi,SJA Taufel,0,0,0
501263,2011,Mumbai,20-05-2011,SR Watson,Wankhede Stadium,Mumbai Indians,Rajasthan Royals,Mumbai Indians,bat,Rajasthan Royals,wickets,10,,"TL Suman, SR Tendulkar, AT Rayudu, RG Sharma, KA Pollard, JEC Franklin, Harbhajan Singh, A Symonds, DS Kulkarni, MM Patel, SL Malinga, SR Watson, R Dravid, J Botha, AL Menaria, AM Rahane, LRPL Taylor, PR Shah, AA Chavan, SK Warne, A Singh, SK Trivedi",RE Koertzen,PR Reiffel,0,0,0
501264,2011,Dharamsala,21-05-2011,S Dhawan,Himachal Pradesh Cricket Association Stadium,Kings XI Punjab,Deccan Chargers,Kings XI Punjab,field,Deccan Chargers,runs,82,,"PC Valthaty, AC Gilchrist, SE Marsh, KD Karthik, R McLaren, AM Nayar, Mandeep Singh, PP Chawla, RJ Harris, P Kumar, BA Bhatt, S Dhawan, DB Ravi Teja, JP Duminy, CL White, KH Devdhar, B Chipli, DT Christian, PP Ojha, A Mishra, DW Steyn, Anand Rajan",Asad Rauf,AM Saheba,0,0,0
501265,2011,Delhi,21-05-2011,,Feroz Shah Kotla,Delhi Daredevils,Pune Warriors,Delhi Daredevils,bat,,,,,"NV Ojha, DA Warner, MS Wade, CA Ingram, Y Venugopal Rao, JR Hopes, IK Pathan, Y Nagar, VR Aaron, UT Yadav, AB Dinda, MK Pandey, JP Faulkner, SC Ganguly, RV Uthappa, Yuvraj Singh, CJ Ferguson, S Rana, MR Marsh, SS Mundhe, R Sharma, AC Thomas",SS Hazare,RJ Tucker,0,0,0
501266,2011,Bangalore,22-05-2011,CH Gayle,M Chinnaswamy Stadium,Royal Challengers Bangalore,Chennai Super Kings,Royal Challengers Bangalore,field,Royal Challengers Bangalore,wickets,8,,"AB de Villiers, CH Gayle, V Kohli, SS Tiwary, MA Agarwal, M Kaif, LA Pomersbach, DL Vettori, S Aravind, A Mithun, Z Khan, MEK Hussey, M Vijay, SK Raina, S Badrinath, WP Saha, MS Dhoni, DJ Bravo, JA Morkel, R Ashwin, SB Jakati, DE Bollinger",K Hariharan,RE Koertzen,0,0,0
501267,2011,Kolkata,22-05-2011,JEC Franklin,Eden Gardens,Kolkata Knight Riders,Mumbai Indians,Mumbai Indians,field,Mumbai Indians,wickets,5,,"JH Kallis, SP Goswami, G Gambhir, MK Tiwary, YK Pathan, RN ten Doeschate, R Bhatia, Shakib Al Hasan, B Lee, L Balaji, Iqbal Abdulla, TL Suman, SR Tendulkar, Harbhajan Singh, RG Sharma, KA Pollard, JEC Franklin, AT Rayudu, R Sathish, AN Ahmed, RW Price, SL Malinga",SK Tarapore,SJA Taufel,0,0,0
501268,2011,Mumbai,24-05-2011,SK Raina,Wankhede Stadium,Royal Challengers Bangalore,Chennai Super Kings,Chennai Super Kings,field,Chennai Super Kings,wickets,6,,"MA Agarwal, CH Gayle, V Kohli, AB de Villiers, LA Pomersbach, SS Tiwary, M Kaif, DL Vettori, S Aravind, A Mithun, Z Khan, MEK Hussey, M Vijay, SK Raina, S Badrinath, MS Dhoni, JA Morkel, DJ Bravo, WP Saha, R Ashwin, DE Bollinger, SB Jakati",Asad Rauf,SJA Taufel,1,0,0
501269,2011,Mumbai,25-05-2011,MM Patel,Wankhede Stadium,Mumbai Indians,Kolkata Knight Riders,Mumbai Indians,field,Mumbai Indians,wickets,4,,"AC Blizzard, SR Tendulkar, RG Sharma, AT Rayudu, JEC Franklin, KA Pollard, TL Suman, Harbhajan Singh, DS Kulkarni, MM Patel, SL Malinga, G Gambhir, JH Kallis, SP Goswami, MK Tiwary, YK Pathan, RN ten Doeschate, Shakib Al Hasan, R Bhatia, B Lee, L Balaji, Iqbal Abdulla",Asad Rauf,SJA Taufel,1,1,0
501270,2011,Chennai,27-05-2011,CH Gayle,"MA Chidambaram Stadium, Chepauk",Royal Challengers Bangalore,Mumbai Indians,Mumbai Indians,field,Royal Challengers Bangalore,runs,43,,"MA Agarwal, CH Gayle, V Kohli, AB de Villiers, LA Pomersbach, SS Tiwary, DL Vettori, S Aravind, A Mithun, Z Khan, J Syed Mohammad, AC Blizzard, SR Tendulkar, Harbhajan Singh, RG Sharma, JEC Franklin, AT Rayudu, KA Pollard, R Sathish, SL Malinga, AN Ahmed, MM Patel",Asad Rauf,SJA Taufel,1,1,0
501271,2011,Chennai,28-05-2011,M Vijay,"MA Chidambaram Stadium, Chepauk",Chennai Super Kings,Royal Challengers Bangalore,Chennai Super Kings,bat,Chennai Super Kings,runs,58,,"MEK Hussey, M Vijay, MS Dhoni, SK Raina, JA Morkel, S Badrinath, DJ Bravo, WP Saha, R Ashwin, DE Bollinger, SB Jakati, MA Agarwal, CH Gayle, V Kohli, AB de Villiers, LA Pomersbach, SS Tiwary, DL Vettori, A Mithun, Z Khan, J Syed Mohammad, S Aravind",Asad Rauf,SJA Taufel,1,1,1
548306,2012,Chennai,04-04-2012,RE Levi,"MA Chidambaram Stadium, Chepauk",Chennai Super Kings,Mumbai Indians,Mumbai Indians,field,Mumbai Indians,wickets,8,,"F du Plessis, M Vijay, SK Raina, DJ Bravo, JA Morkel, S Badrinath, MS Dhoni, RA Jadeja, R Ashwin, SB Jakati, DE Bollinger, RE Levi, SR Tendulkar, RG Sharma, AT Rayudu, JEC Franklin, KD Karthik, KA Pollard, Harbhajan Singh, SL Malinga, AN Ahmed, PP Ojha",JD Cloete,SJA Taufel,0,0,0
548307,2012,Kolkata,05-04-2012,IK Pathan,Eden Gardens,Kolkata Knight Riders,Delhi Daredevils,Delhi Daredevils,field,Delhi Daredevils,wickets,8,,"BB McCullum, JH Kallis, G Gambhir, MK Tiwary, YK Pathan, DB Das, LR Shukla, R Bhatia, B Lee, Iqbal Abdulla, M de Lange, AJ Finch, V Sehwag, IK Pathan, GJ Maxwell, NV Ojha, Y Venugopal Rao, M Morkel, Y Nagar, RE van der Merwe, UT Yadav, S Nadeem",S Asnani,HDPK Dharmasena,0,0,0
548308,2012,Mumbai,06-04-2012,SPD Smith,Wankhede Stadium,Mumbai Indians,Pune Warriors,Mumbai Indians,field,Pune Warriors,runs,28,,"RE Levi, AT Rayudu, RG Sharma, JEC Franklin, KD Karthik, SA Yadav, KA Pollard, Harbhajan Singh, SL Malinga, PP Ojha, MM Patel, MK Pandey, SC Ganguly, WD Parnell, RV Uthappa, CJ Ferguson, SPD Smith, MN Samuels, B Kumar, M Kartik, R Sharma, AB Dinda",AK Chaudhary,SJA Taufel,0,0,0
548309,2012,Jaipur,06-04-2012,AM Rahane,Sawai Mansingh Stadium,Rajasthan Royals,Kings XI Punjab,Kings XI Punjab,field,Rajasthan Royals,runs,31,,"R Dravid, AM Rahane, AL Menaria, BJ Hodge, OA Shah, KK Cooper, J Botha, AA Chavan, SP Goswami, A Singh, SK Trivedi, AC Gilchrist, PC Valthaty, SE Marsh, AM Nayar, DJ Hussey, Mandeep Singh, Bipul Sharma, PP Chawla, JP Faulkner, P Kumar, Harmeet Singh",BF Bowden,SK Tarapore,0,0,0
548310,2012,Bangalore,07-04-2012,AB de Villiers,M Chinnaswamy Stadium,Royal Challengers Bangalore,Delhi Daredevils,Delhi Daredevils,field,Royal Challengers Bangalore,runs,20,,"AB McDonald, CA Pujara, V Kohli, AB de Villiers, SS Tiwary, MA Agarwal, DL Vettori, R Vinay Kumar, HV Patel, Z Khan, M Muralitharan, AJ Finch, V Sehwag, NV Ojha, Y Venugopal Rao, GJ Maxwell, Y Nagar, IK Pathan, DAJ Bracewell, M Morkel, UT Yadav, S Nadeem",S Asnani,S Ravi,0,0,0
548311,2012,Visakhapatnam,07-04-2012,RA Jadeja,Dr. Y.S. Rajasekhara Reddy ACA-VDCA Cricket Stadium,Deccan Chargers,Chennai Super Kings,Deccan Chargers,field,Chennai Super Kings,runs,74,,"DJ Harris, S Dhawan, PA Patel, CL White, B Chipli, DT Christian, MS Gony, DB Ravi Teja, Ankit Sharma, DW Steyn, TP Sudhindra, M Vijay, F du Plessis, SK Raina, S Badrinath, RA Jadeja, MS Dhoni, DJ Bravo, JA Morkel, R Ashwin, SB Jakati, DE Bollinger",JD Cloete,HDPK Dharmasena,0,0,0
548312,2012,Jaipur,08-04-2012,BJ Hodge,Sawai Mansingh Stadium,Rajasthan Royals,Kolkata Knight Riders,Kolkata Knight Riders,field,Rajasthan Royals,runs,22,,"R Dravid, AM Rahane, SP Goswami, AL Menaria, BJ Hodge, OA Shah, KK Cooper, J Botha, AA Chavan, A Singh, SK Trivedi, JH Kallis, BB McCullum, G Gambhir, MK Tiwary, DB Das, YK Pathan, R Bhatia, LR Shukla, B Lee, SP Narine, Iqbal Abdulla",BF Bowden,VA Kulkarni,0,0,0
548313,2012,Pune,08-04-2012,MN Samuels,Subrata Roy Sahara Stadium,Pune Warriors,Kings XI Punjab,Pune Warriors,bat,Pune Warriors,runs,22,,"JD Ryder, SC Ganguly, MN Samuels, RV Uthappa, CJ Ferguson, SPD Smith, MK Pandey, R Sharma, M Kartik, AB Dinda, A Nehra, AC Gilchrist, PC Valthaty, Mandeep Singh, AM Nayar, DJ Hussey, PP Chawla, AD Mascarenhas, Bipul Sharma, JP Faulkner, P Kumar, Harmeet Singh",S Das,SJA Taufel,0,0,0
548314,2012,Visakhapatnam,09-04-2012,RG Sharma,Dr. Y.S. Rajasekhara Reddy ACA-VDCA Cricket Stadium,Deccan Chargers,Mumbai Indians,Deccan Chargers,bat,Mumbai Indians,wickets,5,,"PA Patel, S Dhawan, B Chipli, DT Christian, KC Sangakkara, CL White, DB Ravi Teja, A Mishra, DW Steyn, Ankit Sharma, Anand Rajan, TL Suman, RE Levi, RG Sharma, AT Rayudu, KA Pollard, KD Karthik, JEC Franklin, Harbhajan Singh, SL Malinga, PP Ojha, MM Patel",AK Chaudhary,JD Cloete,0,0,0
548315,2012,Bangalore,10-04-2012,L Balaji,M Chinnaswamy Stadium,Royal Challengers Bangalore,Kolkata Knight Riders,Royal Challengers Bangalore,field,Kolkata Knight Riders,runs,42,,"CA Pujara, CH Gayle, V Kohli, AB de Villiers, SS Tiwary, MA Agarwal, DL Vettori, R Vinay Kumar, HV Patel, Z Khan, M Muralitharan, JH Kallis, G Gambhir, MS Bisla, YK Pathan, MK Tiwary, RN ten Doeschate, Shakib Al Hasan, LR Shukla, B Lee, R Bhatia, L Balaji",S Ravi,RJ Tucker,0,0,0
548316,2012,Delhi,10-04-2012,M Morkel,Feroz Shah Kotla,Delhi Daredevils,Chennai Super Kings,Delhi Daredevils,field,Delhi Daredevils,wickets,8,,"NV Ojha, V Sehwag, KP Pietersen, DPMD Jayawardene, RE van der Merwe, Y Venugopal Rao, Y Nagar, IK Pathan, M Morkel, UT Yadav, S Nadeem, F du Plessis, M Vijay, SK Raina, S Badrinath, RA Jadeja, DJ Bravo, MS Dhoni, JA Morkel, R Ashwin, SB Jakati, DE Bollinger",Asad Rauf,SK Tarapore,0,0,0
548317,2012,Mumbai,11-04-2012,KA Pollard,Wankhede Stadium,Mumbai Indians,Rajasthan Royals,Rajasthan Royals,field,Mumbai Indians,runs,27,,"RE Levi, TL Suman, RG Sharma, AT Rayudu, KA Pollard, KD Karthik, JEC Franklin, Harbhajan Singh, SL Malinga, PP Ojha, MM Patel, R Dravid, AM Rahane, SP Goswami, OA Shah, AL Menaria, J Botha, KK Cooper, AA Chavan, GB Hogg, A Singh, SK Trivedi",Aleem Dar,BNJ Oxenford,0,0,0
548318,2012,Chennai,12-04-2012,F du Plessis,"MA Chidambaram Stadium, Chepauk",Chennai Super Kings,Royal Challengers Bangalore,Royal Challengers Bangalore,bat,Chennai Super Kings,wickets,5,,"M Vijay, F du Plessis, SK Raina, MS Dhoni, DJ Bravo, JA Morkel, RA Jadeja, S Badrinath, R Ashwin, SB Jakati, DE Bollinger, MA Agarwal, CH Gayle, V Kohli, AB de Villiers, SS Tiwary, RR Bhatkal, CA Pujara, DL Vettori, R Vinay Kumar, Z Khan, M Muralitharan",HDPK Dharmasena,RJ Tucker,0,0,0
548319,2012,Chandigarh,12-04-2012,AD Mascarenhas,"Punjab Cricket Association Stadium, Mohali",Kings XI Punjab,Pune Warriors,Kings XI Punjab,field,Kings XI Punjab,wickets,7,,"PC Valthaty, AC Gilchrist, SE Marsh, Mandeep Singh, PP Chawla, DJ Hussey, AD Mascarenhas, P Awana, Bipul Sharma, Harmeet Singh, P Kumar, JD Ryder, SC Ganguly, MN Samuels, RV Uthappa, AD Mathews, M Manhas, SPD Smith, MK Pandey, R Sharma, A Nehra, AB Dinda",VA Kulkarni,SK Tarapore,0,0,0
548320,2012,Kolkata,13-04-2012,Shakib Al Hasan,Eden Gardens,Kolkata Knight Riders,Rajasthan Royals,Rajasthan Royals,bat,Kolkata Knight Riders,wickets,5,,"JH Kallis, G Gambhir, MS Bisla, MK Tiwary, Shakib Al Hasan, YK Pathan, RN ten Doeschate, DB Das, R Bhatia, L Balaji, SP Narine, R Dravid, AM Rahane, AL Menaria, SP Goswami, OA Shah, BJ Hodge, J Botha, GB Hogg, AA Chavan, A Singh, SK Trivedi",Asad Rauf,S Asnani,0,0,0
548321,2012,Delhi,19-04-2012,KP Pietersen,Feroz Shah Kotla,Delhi Daredevils,Deccan Chargers,Deccan Chargers,bat,Delhi Daredevils,wickets,5,,"NV Ojha, V Sehwag, KP Pietersen, DPMD Jayawardene, LRPL Taylor, IK Pathan, Y Nagar, AB Agarkar, M Morkel, UT Yadav, S Nadeem, KC Sangakkara, S Dhawan, PA Patel, DT Christian, JP Duminy, B Chipli, AA Jhunjhunwala, DW Steyn, A Mishra, Ankit Sharma, V Pratap Singh",BF Bowden,SK Tarapore,0,0,0
548322,2012,Pune,14-04-2012,JD Ryder,Subrata Roy Sahara Stadium,Pune Warriors,Chennai Super Kings,Chennai Super Kings,bat,Pune Warriors,wickets,7,,"RV Uthappa, JD Ryder, SC Ganguly, MN Samuels, SPD Smith, AD Mathews, M Manhas, R Sharma, M Kartik, AB Dinda, A Nehra, F du Plessis, M Vijay, SK Raina, MS Dhoni, RA Jadeja, JA Morkel, DJ Bravo, S Badrinath, KMDN Kulasekara, R Ashwin, VY Mahesh",Aleem Dar,BNJ Oxenford,0,0,0
548323,2012,Kolkata,15-04-2012,SP Narine,Eden Gardens,Kolkata Knight Riders,Kings XI Punjab,Kolkata Knight Riders,field,Kings XI Punjab,runs,2,,"JH Kallis, G Gambhir, MS Bisla, MK Tiwary, Shakib Al Hasan, YK Pathan, DB Das, RN ten Doeschate, R Bhatia, SP Narine, JD Unadkat, AC Gilchrist, Mandeep Singh, SE Marsh, DJ Hussey, P Dogra, Bipul Sharma, AD Mascarenhas, PP Chawla, P Kumar, Harmeet Singh, BA Bhatt",Asad Rauf,S Asnani,0,0,0
548324,2012,Bangalore,15-04-2012,AM Rahane,M Chinnaswamy Stadium,Royal Challengers Bangalore,Rajasthan Royals,Rajasthan Royals,bat,Rajasthan Royals,runs,59,,"MA Agarwal, CH Gayle, V Kohli, AB de Villiers, SS Tiwary, M Kaif, DL Vettori, R Vinay Kumar, Z Khan, S Aravind, M Muralitharan, R Dravid, AM Rahane, OA Shah, BJ Hodge, AL Menaria, J Botha, GB Hogg, SP Goswami, A Singh, SK Trivedi, Pankaj Singh",JD Cloete,RJ Tucker,0,0,0
548325,2012,Mumbai,16-04-2012,S Nadeem,Wankhede Stadium,Mumbai Indians,Delhi Daredevils,Delhi Daredevils,field,Delhi Daredevils,wickets,7,,"RE Levi, DJ Jacobs, RG Sharma, AT Rayudu, KA Pollard, KD Karthik, Harbhajan Singh, CJ McKay, RP Singh, PP Ojha, MM Patel, NV Ojha, V Sehwag, KP Pietersen, DPMD Jayawardene, LRPL Taylor, IK Pathan, Y Nagar, AB Agarkar, M Morkel, UT Yadav, S Nadeem",BF Bowden,SK Tarapore,0,0,0
548326,2012,Jaipur,17-04-2012,BJ Hodge,Sawai Mansingh Stadium,Rajasthan Royals,Deccan Chargers,Deccan Chargers,bat,Rajasthan Royals,wickets,5,,"R Dravid, AM Rahane, AL Menaria, OA Shah, BJ Hodge, J Botha, DH Yagnik, GB Hogg, A Singh, SK Trivedi, Pankaj Singh, KC Sangakkara, S Dhawan, DT Christian, JP Duminy, B Chipli, T Mishra, AA Jhunjhunwala, Ankit Sharma, A Mishra, DW Steyn, Anand Rajan",Aleem Dar,BNJ Oxenford,0,0,0
548327,2012,Bangalore,17-04-2012,CH Gayle,M Chinnaswamy Stadium,Royal Challengers Bangalore,Pune Warriors,Pune Warriors,bat,Royal Challengers Bangalore,wickets,6,,"TM Dilshan, CH Gayle, MA Agarwal, V Kohli, SS Tiwary, AB de Villiers, DL Vettori, R Vinay Kumar, Z Khan, HV Patel, KP Appanna, RV Uthappa, JD Ryder, SC Ganguly, MN Samuels, SPD Smith, AD Mathews, M Manhas, B Kumar, R Sharma, AB Dinda, A Nehra",S Asnani,S Das,0,0,0
548328,2012,Chandigarh,18-04-2012,G Gambhir,"Punjab Cricket Association Stadium, Mohali",Kings XI Punjab,Kolkata Knight Riders,Kings XI Punjab,bat,Kolkata Knight Riders,wickets,8,,"AC Gilchrist, PC Valthaty, SE Marsh, Mandeep Singh, DJ Hussey, P Dogra, AD Mascarenhas, PP Chawla, Harmeet Singh, P Kumar, BA Bhatt, BB McCullum, G Gambhir, MS Bisla, JH Kallis, MK Tiwary, YK Pathan, R Bhatia, DB Das, SP Narine, L Balaji, B Lee",JD Cloete,RJ Tucker,0,0,0
548329,2012,Hyderabad,10-05-2012,DA Warner,"Rajiv Gandhi International Stadium, Uppal",Deccan Chargers,Delhi Daredevils,Deccan Chargers,bat,Delhi Daredevils,wickets,9,,"DJ Harris, S Dhawan, KC Sangakkara, CL White, JP Duminy, PA Patel, Ankit Sharma, A Ashish Reddy, A Mishra, MS Gony, TP Sudhindra, V Sehwag, DA Warner, NV Ojha, DPMD Jayawardene, Y Nagar, AD Russell, Y Venugopal Rao, IK Pathan, M Morkel, S Nadeem, VR Aaron",JD Cloete,SJA Taufel,0,0,0
548330,2012,Chennai,19-04-2012,KMDN Kulasekara,"MA Chidambaram Stadium, Chepauk",Chennai Super Kings,Pune Warriors,Pune Warriors,field,Chennai Super Kings,runs,13,,"F du Plessis, S Badrinath, SK Raina, MS Dhoni, DJ Bravo, RA Jadeja, WP Saha, KMDN Kulasekara, R Ashwin, SB Jakati, DE Bollinger, RV Uthappa, JD Ryder, SC Ganguly, MK Pandey, MN Samuels, SPD Smith, AD Mathews, B Kumar, M Kartik, R Sharma, A Nehra",Asad Rauf,S Das,0,0,0
548331,2012,Chandigarh,20-04-2012,CH Gayle,"Punjab Cricket Association Stadium, Mohali",Kings XI Punjab,Royal Challengers Bangalore,Royal Challengers Bangalore,field,Royal Challengers Bangalore,wickets,5,,"N Saini, PC Valthaty, SE Marsh, DJ Hussey, DA Miller, Mandeep Singh, Azhar Mahmood, PP Chawla, P Awana, P Kumar, Harmeet Singh, MA Agarwal, CH Gayle, V Kohli, SS Tiwary, AB de Villiers, AB McDonald, DL Vettori, KB Arun Karthik, R Vinay Kumar, HV Patel, Z Khan",S Ravi,RJ Tucker,0,0,0
548332,2012,Chennai,21-04-2012,F du Plessis,"MA Chidambaram Stadium, Chepauk",Chennai Super Kings,Rajasthan Royals,Rajasthan Royals,bat,Chennai Super Kings,wickets,7,,"S Badrinath, F du Plessis, SK Raina, MS Dhoni, DJ Bravo, RA Jadeja, WP Saha, R Ashwin, KMDN Kulasekara, SB Jakati, DE Bollinger, R Dravid, AM Rahane, OA Shah, AL Menaria, BJ Hodge, SP Goswami, STR Binny, KK Cooper, GB Hogg, A Singh, SK Trivedi",Aleem Dar,BNJ Oxenford,0,0,0
548333,2012,Delhi,21-04-2012,SC Ganguly,Feroz Shah Kotla,Delhi Daredevils,Pune Warriors,Delhi Daredevils,field,Pune Warriors,runs,20,,"DPMD Jayawardene, V Sehwag, KP Pietersen, IK Pathan, P Negi, LRPL Taylor, Y Nagar, NV Ojha, M Morkel, S Nadeem, UT Yadav, RV Uthappa, JD Ryder, SC Ganguly, SPD Smith, AD Mathews, MK Pandey, AC Thomas, M Manhas, M Kartik, R Sharma, A Nehra",Asad Rauf,S Das,0,0,0
548334,2012,Mumbai,22-04-2012,SE Marsh,Wankhede Stadium,Mumbai Indians,Kings XI Punjab,Mumbai Indians,bat,Kings XI Punjab,wickets,6,,"JEC Franklin, SR Tendulkar, RG Sharma, KD Karthik, KA Pollard, Harbhajan Singh, NLTC Perera, AT Rayudu, PP Ojha, RP Singh, MM Patel, N Saini, Mandeep Singh, SE Marsh, DJ Hussey, Azhar Mahmood, DA Miller, SD Chitnis, PP Chawla, BA Bhatt, P Kumar, P Awana",S Ravi,RJ Tucker,0,0,0
548335,2012,Cuttack,22-04-2012,B Lee,Barabati Stadium,Deccan Chargers,Kolkata Knight Riders,Kolkata Knight Riders,field,Kolkata Knight Riders,wickets,5,,"KC Sangakkara, S Dhawan, PA Patel, CL White, JP Duminy, IR Jaggi, Ankit Sharma, DW Steyn, A Mishra, Anand Rajan, V Pratap Singh, BB McCullum, G Gambhir, MS Bisla, JH Kallis, YK Pathan, MK Tiwary, DB Das, R Bhatia, SP Narine, L Balaji, B Lee",BF Bowden,SK Tarapore,0,0,0
548336,2012,Jaipur,23-04-2012,AB de Villiers,Sawai Mansingh Stadium,Rajasthan Royals,Royal Challengers Bangalore,Rajasthan Royals,field,Royal Challengers Bangalore,runs,46,,"R Dravid, AM Rahane, OA Shah, SP Goswami, BJ Hodge, STR Binny, KK Cooper, GB Hogg, Pankaj Singh, SK Trivedi, A Chandila, V Kohli, TM Dilshan, MA Agarwal, CH Gayle, AB de Villiers, SS Tiwary, DL Vettori, R Vinay Kumar, Z Khan, HV Patel, KP Appanna",Asad Rauf,S Asnani,0,0,0
548337,2012,Pune,24-04-2012,V Sehwag,Subrata Roy Sahara Stadium,Pune Warriors,Delhi Daredevils,Pune Warriors,bat,Delhi Daredevils,wickets,8,,"JD Ryder, MK Pandey, SC Ganguly, RV Uthappa, SPD Smith, LJ Wright, AC Thomas, M Manhas, M Kartik, R Sharma, A Nehra, DPMD Jayawardene, V Sehwag, KP Pietersen, LRPL Taylor, NV Ojha, IK Pathan, Y Nagar, M Morkel, P Negi, S Nadeem, UT Yadav",S Ravi,RJ Tucker,0,0,0
548338,2012,Kolkata,24-04-2012,,Eden Gardens,Kolkata Knight Riders,Deccan Charges,,,,,,,,Billy Bowden,Vineet Kulkarni,0,0,0
548339,2012,Chandigarh,25-04-2012,AT Rayudu,"Punjab Cricket Association Stadium, Mohali",Kings XI Punjab,Mumbai Indians,Kings XI Punjab,bat,Mumbai Indians,wickets,4,,"N Saini, Mandeep Singh, SE Marsh, DJ Hussey, DA Miller, SD Chitnis, Azhar Mahmood, PP Chawla, BA Bhatt, P Kumar, P Awana, JEC Franklin, SR Tendulkar, RG Sharma, KD Karthik, KA Pollard, AT Rayudu, Harbhajan Singh, RJ Peterson, RP Singh, MM Patel, CJ McKay",Aleem Dar,BNJ Oxenford,0,0,0
548340,2012,Bangalore,25-04-2012,,M Chinnaswamy Stadium,Royal Challengers Bangalore,Chennai Super Kings,,,,,,,,Billy Doctrove,Sudhir Asnani,0,0,0
548341,2012,Pune,26-04-2012,CL White,Subrata Roy Sahara Stadium,Pune Warriors,Deccan Chargers,Deccan Chargers,bat,Deccan Chargers,runs,18,,"MK Pandey, JD Ryder, SC Ganguly, RV Uthappa, MN Samuels, SPD Smith, M Manhas, AC Thomas, B Kumar, R Sharma, A Nehra, PA Patel, S Dhawan, CL White, KC Sangakkara, JP Duminy, IR Jaggi, Ankit Sharma, A Ashish Reddy, A Mishra, J Theron, MS Gony",S Ravi,RJ Tucker,0,0,0
548342,2012,Delhi,27-04-2012,V Sehwag,Feroz Shah Kotla,Delhi Daredevils,Mumbai Indians,Mumbai Indians,field,Delhi Daredevils,runs,37,,"DPMD Jayawardene, V Sehwag, KP Pietersen, IK Pathan, LRPL Taylor, Y Nagar, NV Ojha, M Morkel, S Nadeem, UT Yadav, AB Agarkar, AC Blizzard, SR Tendulkar, RG Sharma, KD Karthik, AT Rayudu, KA Pollard, RJ Peterson, Harbhajan Singh, SL Malinga, RP Singh, R Shukla",Aleem Dar,BNJ Oxenford,0,0,0
548343,2012,Chennai,28-04-2012,Mandeep Singh,"MA Chidambaram Stadium, Chepauk",Chennai Super Kings,Kings XI Punjab,Kings XI Punjab,bat,Kings XI Punjab,runs,7,,"F du Plessis, S Badrinath, SK Raina, WP Saha, RA Jadeja, MS Dhoni, DJ Bravo, JA Morkel, KMDN Kulasekara, R Ashwin, SB Jakati, Mandeep Singh, SE Marsh, Azhar Mahmood, DA Miller, DJ Hussey, Bipul Sharma, PP Chawla, N Saini, P Kumar, P Awana, BA Bhatt",BF Bowden,SK Tarapore,0,0,0
548344,2012,Kolkata,28-04-2012,G Gambhir,Eden Gardens,Kolkata Knight Riders,Royal Challengers Bangalore,Kolkata Knight Riders,bat,Kolkata Knight Riders,runs,47,,"BB McCullum, G Gambhir, JH Kallis, YK Pathan, MK Tiwary, LR Shukla, R Bhatia, DB Das, SP Narine, B Lee, Iqbal Abdulla, TM Dilshan, CH Gayle, V Kohli, AB de Villiers, SS Tiwary, MA Agarwal, DL Vettori, R Vinay Kumar, Z Khan, HV Patel, KP Appanna",Asad Rauf,BR Doctrove,0,0,0
548345,2012,Delhi,29-04-2012,V Sehwag,Feroz Shah Kotla,Delhi Daredevils,Rajasthan Royals,Delhi Daredevils,bat,Delhi Daredevils,runs,1,,"DPMD Jayawardene, V Sehwag, KP Pietersen, LRPL Taylor, Y Nagar, NV Ojha, IK Pathan, AB Agarkar, M Morkel, S Nadeem, UT Yadav, R Dravid, AM Rahane, BJ Hodge, OA Shah, SP Goswami, AL Menaria, KK Cooper, GB Hogg, AA Chavan, A Singh, Pankaj Singh",S Ravi,RJ Tucker,0,0,0
548346,2012,Mumbai,29-04-2012,DW Steyn,Wankhede Stadium,Mumbai Indians,Deccan Chargers,Mumbai Indians,field,Mumbai Indians,wickets,5,,"RE Levi, SR Tendulkar, RG Sharma, KD Karthik, JEC Franklin, AT Rayudu, RJ Peterson, Harbhajan Singh, SL Malinga, RP Singh, MM Patel, PA Patel, S Dhawan, IR Jaggi, CL White, JP Duminy, DT Christian, B Chipli, A Ashish Reddy, A Mishra, DW Steyn, V Pratap Singh",AK Chaudhary,BNJ Oxenford,0,0,0
548347,2012,Chennai,30-04-2012,G Gambhir,"MA Chidambaram Stadium, Chepauk",Chennai Super Kings,Kolkata Knight Riders,Chennai Super Kings,bat,Kolkata Knight Riders,wickets,5,,"F du Plessis, MEK Hussey, SK Raina, DJ Bravo, MS Dhoni, RA Jadeja, JA Morkel, S Badrinath, R Ashwin, SB Jakati, VY Mahesh, G Gambhir, BB McCullum, JH Kallis, MK Tiwary, YK Pathan, DB Das, LR Shukla, R Bhatia, SP Narine, B Lee, Iqbal Abdulla",BF Bowden,C Shamshuddin,0,0,0
548348,2012,Cuttack,01-05-2012,KC Sangakkara,Barabati Stadium,Deccan Chargers,Pune Warriors,Deccan Chargers,bat,Deccan Chargers,runs,13,,"PA Patel, S Dhawan, CL White, KC Sangakkara, JP Duminy, BB Samantray, Ankit Sharma, A Ashish Reddy, A Mishra, DW Steyn, V Pratap Singh, MK Pandey, MJ Clarke, SC Ganguly, SPD Smith, RV Uthappa, M Manhas, MN Samuels, WD Parnell, M Kartik, B Kumar, A Nehra",Aleem Dar,AK Chaudhary,0,0,0
548349,2012,Jaipur,01-05-2012,P Negi,Sawai Mansingh Stadium,Rajasthan Royals,Delhi Daredevils,Rajasthan Royals,bat,Delhi Daredevils,wickets,6,,"R Dravid, AM Rahane, SR Watson, OA Shah, BJ Hodge, AL Menaria, SP Goswami, AA Chavan, GB Hogg, A Singh, Pankaj Singh, DPMD Jayawardene, V Sehwag, KP Pietersen, LRPL Taylor, Y Nagar, NV Ojha, IK Pathan, P Negi, M Morkel, S Nadeem, UT Yadav",JD Cloete,SJA Taufel,0,0,0
548350,2012,Bangalore,02-05-2012,Azhar Mahmood,M Chinnaswamy Stadium,Royal Challengers Bangalore,Kings XI Punjab,Kings XI Punjab,field,Kings XI Punjab,wickets,4,,"MA Agarwal, CH Gayle, V Kohli, AB de Villiers, AB McDonald, AUK Pathan, SS Tiwary, DL Vettori, R Vinay Kumar, Z Khan, KP Appanna, Mandeep Singh, SE Marsh, N Saini, DJ Hussey, Azhar Mahmood, AM Nayar, P Dogra, PP Chawla, RJ Harris, P Kumar, P Awana",BF Bowden,C Shamshuddin,0,0,0
548351,2012,Pune,03-05-2012,SL Malinga,Subrata Roy Sahara Stadium,Pune Warriors,Mumbai Indians,Mumbai Indians,bat,Mumbai Indians,runs,1,,"RV Uthappa, JD Ryder, MJ Clarke, SC Ganguly, SPD Smith, M Manhas, WD Parnell, B Kumar, M Kartik, A Nehra, AB Dinda, JEC Franklin, SR Tendulkar, RG Sharma, RJ Peterson, KD Karthik, AT Rayudu, NLTC Perera, Harbhajan Singh, SL Malinga, PP Ojha, MM Patel",Asad Rauf,S Asnani,0,0,0
