match_id,year,city,date,player_of_match,venue,team1,team2,toss_winner,toss_decision,winner,result,result_margin,method,players,umpire1,umpire2,playoff,knockout,final
335982,2008,Bangalore,18-04-2008,BB McCullum,M Chinnaswamy Stadium,Royal Challengers Bangalore,Kolkata Knight Riders,Royal Challengers Bangalore,field,Kolkata Knight Riders,runs,140,,"R Dravid, W Jaffer, V Kohli, JH Kallis, CL White, MV Boucher, B Akhil, AA Noffke, P Kumar, Z Khan, SB Joshi, SC Ganguly, BB McCullum, RT Ponting, DJ Hussey, Mohammad Hafeez, LR Shukla, WP Saha, AB Agarkar, AB Dinda, M Kartik, I Sharma",Asad Rauf,RE Koertzen,0,0,0
335983,2008,Chandigarh,19-04-2008,MEK Hussey,"Punjab Cricket Association Stadium, Mohali",Kings XI Punjab,Chennai Super Kings,Chennai Super Kings,bat,Chennai Super Kings,runs,33,,"K Goel, JR Hopes, KC Sangakkara, Yuvraj Singh, SM Katich, IK Pathan, P Dharmani, B Lee, PP Chawla, WA Mota, S Sreesanth, PA Patel, ML Hayden, MEK Hussey, MS Dhoni, SK Raina, JDP Oram, S Badrinath, Joginder Sharma, P Amarnath, MS Gony, M Muralitharan",MR Benson,SL Shastri,0,0,0
335984,2008,Delhi,19-04-2008,MF Maharoof,Feroz Shah Kotla,Delhi Daredevils,Rajasthan Royals,Rajasthan Royals,bat,Delhi Daredevils,wickets,9,,"G Gambhir, V Sehwag, S Dhawan, MK Tiwary, KD Karthik, R Bhatia, M Manhas, DL Vettori, MF Maharoof, B Geeves, GD McGrath, T Kohli, YK Pathan, SR Watson, M Kaif, DS Lehmann, RA Jadeja, M Rawat, D Salunkhe, SK Warne, SK Trivedi, MM Patel",Aleem Dar,GA Pratapkumar,0,0,0
335985,2008,Mumbai,20-04-2008,MV Boucher,Wankhede Stadium,Mumbai Indians,Royal Challengers Bangalore,Mumbai Indians,bat,Royal Challengers Bangalore,wickets,5,,"L Ronchi, ST Jayasuriya, DJ Thornely, RV Uthappa, PR Shah, AM Nayar, SM Pollock, Harbhajan Singh, MA Khote, A Nehra, DS Kulkarni, S Chanderpaul, R Dravid, LRPL Taylor, JH Kallis, V Kohli, MV Boucher, B Akhil, P Kumar, Z Khan, SB Joshi, R Vinay Kumar",SJ Davis,DJ Harper,0,0,0
335986,2008,Kolkata,20-04-2008,DJ Hussey,Eden Gardens,Kolkata Knight Riders,Deccan Chargers,Deccan Chargers,bat,Kolkata Knight Riders,wickets,5,,"WP Saha, BB McCullum, RT Ponting, SC Ganguly, DJ Hussey, Mohammad Hafeez, LR Shukla, AB Agarkar, AB Dinda, M Kartik, I Sharma, AC Gilchrist, Y Venugopal Rao, VVS Laxman, A Symonds, RG Sharma, SB Styris, AS Yadav, SB Bangar, WPUJC Vaas, RP Singh, PP Ojha",BF Bowden,K Hariharan,0,0,0
335987,2008,Jaipur,21-04-2008,SR Watson,Sawai Mansingh Stadium,Rajasthan Royals,Kings XI Punjab,Kings XI Punjab,bat,Rajasthan Royals,wickets,6,,"M Kaif, Kamran Akmal, YK Pathan, SR Watson, DS Lehmann, RA Jadeja, Pankaj Singh, D Salunkhe, SK Warne, SK Trivedi, MM Patel, K Goel, JR Hopes, KC Sangakkara, DPMD Jayawardene, Yuvraj Singh, IK Pathan, S Sohal, B Lee, PP Chawla, WA Mota, S Sreesanth",Aleem Dar,RB Tiffin,0,0,0
335988,2008,Hyderabad,22-04-2008,V Sehwag,"Rajiv Gandhi International Stadium, Uppal",Deccan Chargers,Delhi Daredevils,Deccan Chargers,bat,Delhi Daredevils,wickets,9,,"AC Gilchrist, Y Venugopal Rao, VVS Laxman, A Symonds, RG Sharma, Shahid Afridi, SB Bangar, AS Yadav, WPUJC Vaas, RP Singh, PP Ojha, G Gambhir, V Sehwag, S Dhawan, Shoaib Malik, KD Karthik, MK Tiwary, R Bhatia, MF Maharoof, Mohammad Asif, VY Mahesh, GD McGrath",IL Howell,AM Saheba,0,0,0
335989,2008,Chennai,23-04-2008,ML Hayden,"MA Chidambaram Stadium, Chepauk",Chennai Super Kings,Mumbai Indians,Mumbai Indians,field,Chennai Super Kings,runs,6,,"PA Patel, ML Hayden, MEK Hussey, SK Raina, MS Dhoni, JDP Oram, S Badrinath, Joginder Sharma, P Amarnath, MS Gony, M Muralitharan, L Ronchi, ST Jayasuriya, RV Uthappa, SM Pollock, DJ Bravo, AM Nayar, MA Khote, Harbhajan Singh, A Nehra, VS Yeligati, DS Kulkarni",DJ Harper,GA Pratapkumar,0,0,0
335990,2008,Hyderabad,24-04-2008,YK Pathan,"Rajiv Gandhi International Stadium, Uppal",Deccan Chargers,Rajasthan Royals,Rajasthan Royals,field,Rajasthan Royals,wickets,3,,"AC Gilchrist, VVS Laxman, Shahid Afridi, A Symonds, RG Sharma, AS Yadav, SB Bangar, WPUJC Vaas, RP Singh, PP Ojha, D Kalyankrishna, Kamran Akmal, GC Smith, YK Pathan, SR Watson, M Kaif, RA Jadeja, SK Warne, D Salunkhe, Pankaj Singh, SK Trivedi, MM Patel",Asad Rauf,MR Benson,0,0,0
335991,2008,Chandigarh,25-04-2008,KC Sangakkara,"Punjab Cricket Association Stadium, Mohali",Kings XI Punjab,Mumbai Indians,Mumbai Indians,field,Kings XI Punjab,runs,66,,"K Goel, IK Pathan, KC Sangakkara, Yuvraj Singh, RR Sarwan, DPMD Jayawardene, S Sohal, B Lee, PP Chawla, S Sreesanth, VRV Singh, L Ronchi, ST Jayasuriya, RV Uthappa, DJ Bravo, SS Tiwary, SM Pollock, AM Nayar, Harbhajan Singh, MA Khote, DS Kulkarni, A Nehra",Aleem Dar,AM Saheba,0,0,0
335992,2008,Bangalore,26-04-2008,SR Watson,M Chinnaswamy Stadium,Royal Challengers Bangalore,Rajasthan Royals,Rajasthan Royals,field,Rajasthan Royals,wickets,7,,"S Chanderpaul, R Dravid, LRPL Taylor, JH Kallis, V Kohli, MV Boucher, P Kumar, SB Joshi, Z Khan, R Vinay Kumar, A Kumble, GC Smith, M Rawat, YK Pathan, SR Watson, M Kaif, RA Jadeja, D Salunkhe, SK Warne, Sohail Tanvir, SK Trivedi, MM Patel",MR Benson,IL Howell,0,0,0
335993,2008,Chennai,26-04-2008,JDP Oram,"MA Chidambaram Stadium, Chepauk",Chennai Super Kings,Kolkata Knight Riders,Kolkata Knight Riders,bat,Chennai Super Kings,wickets,9,,"PA Patel, ML Hayden, MS Dhoni, MEK Hussey, S Badrinath, SK Raina, JDP Oram, Joginder Sharma, P Amarnath, MS Gony, M Muralitharan, SC Ganguly, BB McCullum, RT Ponting, WP Saha, DJ Hussey, Mohammad Hafeez, LR Shukla, AB Agarkar, M Kartik, I Sharma, AB Dinda",BF Bowden,AV Jayaprakash,0,0,0
335994,2008,Mumbai,27-04-2008,AC Gilchrist,Dr DY Patil Sports Academy,Mumbai Indians,Deccan Chargers,Deccan Chargers,field,Deccan Chargers,wickets,10,,"L Ronchi, ST Jayasuriya, AM Rahane, RV Uthappa, SM Pollock, AM Nayar, DJ Bravo, MA Khote, A Nehra, DS Kulkarni, SD Chitnis, AC Gilchrist, VVS Laxman, A Symonds, RG Sharma, Shahid Afridi, SB Bangar, AS Yadav, RP Singh, PP Ojha, D Kalyankrishna, DNT Zoysa",Asad Rauf,SL Shastri,0,0,0
335995,2008,Chandigarh,27-04-2008,SM Katich,"Punjab Cricket Association Stadium, Mohali",Kings XI Punjab,Delhi Daredevils,Delhi Daredevils,bat,Kings XI Punjab,wickets,4,,"K Goel, SM Katich, KC Sangakkara, DPMD Jayawardene, Yuvraj Singh, TM Srivastava, IK Pathan, B Lee, PP Chawla, S Sreesanth, VRV Singh, G Gambhir, V Sehwag, S Dhawan, Shoaib Malik, MK Tiwary, KD Karthik, R Bhatia, MF Maharoof, VY Mahesh, Mohammad Asif, GD McGrath",RE Koertzen,I Shivram,0,0,0
335996,2008,Bangalore,28-04-2008,MS Dhoni,M Chinnaswamy Stadium,Royal Challengers Bangalore,Chennai Super Kings,Chennai Super Kings,bat,Chennai Super Kings,runs,13,,"B Chipli, W Jaffer, LRPL Taylor, JH Kallis, MV Boucher, V Kohli, R Dravid, P Kumar, Z Khan, B Akhil, DW Steyn, PA Patel, ML Hayden, MEK Hussey, SK Raina, MS Dhoni, JDP Oram, S Badrinath, JA Morkel, Joginder Sharma, P Amarnath, MS Gony",BR Doctrove,RB Tiffin,0,0,0
335997,2008,Kolkata,29-04-2008,ST Jayasuriya,Eden Gardens,Kolkata Knight Riders,Mumbai Indians,Kolkata Knight Riders,bat,Mumbai Indians,wickets,7,,"BB McCullum, SC Ganguly, RT Ponting, DB Das, DJ Hussey, Mohammad Hafeez, LR Shukla, AB Agarkar, M Kartik, I Sharma, AB Dinda, AM Rahane, ST Jayasuriya, MK Pandey, RV Uthappa, DJ Bravo, SM Pollock, AM Nayar, A Nehra, DS Kulkarni, CRD Fernando, PR Shah",BF Bowden,AV Jayaprakash,0,0,0
335998,2008,Delhi,30-04-2008,GD McGrath,Feroz Shah Kotla,Delhi Daredevils,Royal Challengers Bangalore,Royal Challengers Bangalore,field,Delhi Daredevils,runs,10,,"G Gambhir, V Sehwag, S Dhawan, Shoaib Malik, KD Karthik, MK Tiwary, R Bhatia, DL Vettori, Mohammad Asif, VY Mahesh, GD McGrath, P Kumar, W Jaffer, LRPL Taylor, JH Kallis, R Dravid, MV Boucher, V Kohli, Z Khan, DW Steyn, R Vinay Kumar, SB Joshi",Aleem Dar,I Shivram,0,0,0
335999,2008,Hyderabad,01-05-2008,SE Marsh,"Rajiv Gandhi International Stadium, Uppal",Deccan Chargers,Kings XI Punjab,Kings XI Punjab,field,Kings XI Punjab,wickets,7,,"AC Gilchrist, VVS Laxman, HH Gibbs, RG Sharma, Shahid Afridi, Y Venugopal Rao, SB Bangar, DNT Zoysa, D Kalyankrishna, RP Singh, PP Ojha, SE Marsh, RR Sarwan, KC Sangakkara, Yuvraj Singh, DPMD Jayawardene, K Goel, IK Pathan, PP Chawla, S Sreesanth, VRV Singh, Gagandeep Singh",BR Doctrove,RB Tiffin,0,0,0
336000,2008,Jaipur,01-05-2008,SA Asnodkar,Sawai Mansingh Stadium,Rajasthan Royals,Kolkata Knight Riders,Rajasthan Royals,bat,Rajasthan Royals,runs,45,,"GC Smith, SA Asnodkar, M Kaif, YK Pathan, SR Watson, RA Jadeja, SK Warne, Sohail Tanvir, M Rawat, SK Trivedi, MM Patel, Salman Butt, SC Ganguly, AB Agarkar, BJ Hodge, DJ Hussey, LR Shukla, DB Das, WP Saha, Umar Gul, I Sharma, AB Dinda",RE Koertzen,GA Pratapkumar,0,0,0
336001,2008,Chennai,02-05-2008,V Sehwag,"MA Chidambaram Stadium, Chepauk",Chennai Super Kings,Delhi Daredevils,Chennai Super Kings,bat,Delhi Daredevils,wickets,8,,"PA Patel, SP Fleming, S Vidyut, MS Dhoni, JA Morkel, SK Raina, S Badrinath, Joginder Sharma, M Ntini, MS Gony, M Muralitharan, G Gambhir, V Sehwag, AB de Villiers, S Dhawan, Shoaib Malik, KD Karthik, R Bhatia, VY Mahesh, GD McGrath, PJ Sangwan, Mohammad Asif",BF Bowden,K Hariharan,0,0,0
336002,2008,Hyderabad,25-05-2008,R Vinay Kumar,"Rajiv Gandhi International Stadium, Uppal",Deccan Chargers,Royal Challengers Bangalore,Deccan Chargers,bat,Royal Challengers Bangalore,wickets,5,,"AC Gilchrist, HH Gibbs, RG Sharma, LPC Silva, Y Venugopal Rao, DB Ravi Teja, AS Yadav, SB Bangar, WPUJC Vaas, RP Singh, DP Vijaykumar, JH Kallis, W Jaffer, Misbah-ul-Haq, R Dravid, CL White, V Kohli, B Akhil, SP Goswami, R Vinay Kumar, A Kumble, DW Steyn",Asad Rauf,RE Koertzen,0,0,0
336003,2008,Chandigarh,03-05-2008,IK Pathan,"Punjab Cricket Association Stadium, Mohali",Kings XI Punjab,Kolkata Knight Riders,Kings XI Punjab,bat,Kings XI Punjab,runs,9,,"SE Marsh, JR Hopes, KC Sangakkara, Yuvraj Singh, DPMD Jayawardene, K Goel, IK Pathan, PP Chawla, S Sreesanth, VRV Singh, Gagandeep Singh, Mohammad Hafeez, SC Ganguly, DB Das, BJ Hodge, DJ Hussey, LR Shukla, WP Saha, AB Agarkar, Umar Gul, I Sharma, AB Dinda",DJ Harper,I Shivram,0,0,0
336004,2008,Mumbai,04-05-2008,SM Pollock,Dr DY Patil Sports Academy,Mumbai Indians,Delhi Daredevils,Delhi Daredevils,field,Mumbai Indians,runs,29,,"YV Takawale, ST Jayasuriya, DJ Thornely, RV Uthappa, DJ Bravo, AM Nayar, SM Pollock, SS Tiwary, RR Raje, A Nehra, DS Kulkarni, G Gambhir, V Sehwag, S Dhawan, AB de Villiers, Shoaib Malik, KD Karthik, R Bhatia, PJ Sangwan, VY Mahesh, Mohammad Asif, GD McGrath",IL Howell,RE Koertzen,0,0,0
336005,2008,Jaipur,04-05-2008,Sohail Tanvir,Sawai Mansingh Stadium,Rajasthan Royals,Chennai Super Kings,Chennai Super Kings,bat,Rajasthan Royals,wickets,8,,"GC Smith, SA Asnodkar, YK Pathan, SR Watson, M Rawat, M Kaif, RA Jadeja, SK Warne, Sohail Tanvir, SK Trivedi, MM Patel, PA Patel, SP Fleming, S Vidyut, SK Raina, S Badrinath, MS Dhoni, JA Morkel, Joginder Sharma, MS Gony, M Muralitharan, M Ntini",Asad Rauf,AV Jayaprakash,0,0,0
336006,2008,Bangalore,05-05-2008,S Sreesanth,M Chinnaswamy Stadium,Royal Challengers Bangalore,Kings XI Punjab,Kings XI Punjab,field,Kings XI Punjab,wickets,6,,"W Jaffer, V Kohli, CL White, JH Kallis, R Dravid, Misbah-ul-Haq, P Kumar, DT Patil, Z Khan, A Kumble, DW Steyn, SE Marsh, JR Hopes, RR Sarwan, Yuvraj Singh, DPMD Jayawardene, IK Pathan, PP Chawla, U Kaul, Gagandeep Singh, S Sreesanth, VRV Singh",SJ Davis,BR Doctrove,0,0,0
336007,2008,Chennai,06-05-2008,AC Gilchrist,"MA Chidambaram Stadium, Chepauk",Chennai Super Kings,Deccan Chargers,Deccan Chargers,field,Deccan Chargers,wickets,7,,"PA Patel, SP Fleming, S Anirudha, SK Raina, S Badrinath, MS Dhoni, JA Morkel, Joginder Sharma, MS Gony, M Ntini, M Muralitharan, AC Gilchrist, HH Gibbs, SB Styris, RG Sharma, Shahid Afridi, Y Venugopal Rao, SB Bangar, AS Yadav, RP Singh, DP Vijaykumar, PP Ojha",MR Benson,RB Tiffin,0,0,0
336008,2008,Mumbai,07-05-2008,A Nehra,Dr DY Patil Sports Academy,Mumbai Indians,Rajasthan Royals,Mumbai Indians,field,Mumbai Indians,wickets,7,,"YV Takawale, ST Jayasuriya, RV Uthappa, DJ Bravo, AM Nayar, DJ Thornely, SM Pollock, SS Tiwary, RR Raje, A Nehra, DS Kulkarni, GC Smith, SA Asnodkar, YK Pathan, SR Watson, M Kaif, RA Jadeja, SK Warne, Sohail Tanvir, M Rawat, SK Trivedi, MM Patel",DJ Harper,RE Koertzen,0,0,0
336009,2008,Delhi,08-05-2008,MS Dhoni,Feroz Shah Kotla,Delhi Daredevils,Chennai Super Kings,Chennai Super Kings,field,Chennai Super Kings,wickets,4,,"G Gambhir, V Sehwag, AB de Villiers, S Dhawan, Shoaib Malik, KD Karthik, MK Tiwary, VY Mahesh, GD McGrath, Mohammad Asif, PJ Sangwan, S Vidyut, SP Fleming, MS Dhoni, SK Raina, JA Morkel, CK Kapugedera, S Badrinath, MS Gony, P Amarnath, M Muralitharan, L Balaji",Aleem Dar,RB Tiffin,0,0,0
336010,2008,Kolkata,08-05-2008,SC Ganguly,Eden Gardens,Kolkata Knight Riders,Royal Challengers Bangalore,Kolkata Knight Riders,bat,Kolkata Knight Riders,runs,5,,"A Chopra, BJ Hodge, SC Ganguly, DJ Hussey, T Taibu, LR Shukla, WP Saha, M Kartik, Umar Gul, I Sharma, AB Dinda, J Arunkumar, S Chanderpaul, MV Boucher, R Dravid, CL White, P Kumar, R Vinay Kumar, V Kohli, Z Khan, A Kumble, DW Steyn",Asad Rauf,IL Howell,0,0,0
336011,2008,Jaipur,09-05-2008,YK Pathan,Sawai Mansingh Stadium,Rajasthan Royals,Deccan Chargers,Rajasthan Royals,field,Rajasthan Royals,wickets,8,,"GC Smith, YK Pathan, M Kaif, SR Watson, NK Patel, RA Jadeja, SK Warne, M Rawat, Sohail Tanvir, SK Trivedi, MM Patel, AC Gilchrist, HH Gibbs, SB Styris, RG Sharma, Shahid Afridi, SB Bangar, DB Ravi Teja, Y Venugopal Rao, RP Singh, PP Ojha, DP Vijaykumar",MR Benson,AM Saheba,0,0,0
336012,2008,Bangalore,28-05-2008,CRD Fernando,M Chinnaswamy Stadium,Royal Challengers Bangalore,Mumbai Indians,Mumbai Indians,field,Mumbai Indians,wickets,9,,"MV Boucher, SP Goswami, Misbah-ul-Haq, R Dravid, CL White, V Kohli, B Akhil, P Kumar, R Vinay Kumar, A Kumble, DW Steyn, ST Jayasuriya, SR Tendulkar, RV Uthappa, DR Smith, AM Nayar, SM Pollock, MK Pandey, YV Takawale, DS Kulkarni, CRD Fernando, A Nehra",BF Bowden,AV Jayaprakash,0,0,0
336013,2008,Chennai,10-05-2008,L Balaji,"MA Chidambaram Stadium, Chepauk",Chennai Super Kings,Kings XI Punjab,Kings XI Punjab,field,Chennai Super Kings,runs,18,,"S Vidyut, SP Fleming, SK Raina, S Badrinath, MS Dhoni, JA Morkel, CK Kapugedera, P Amarnath, MS Gony, M Muralitharan, L Balaji, SE Marsh, JR Hopes, K Goel, RR Sarwan, Yuvraj Singh, DPMD Jayawardene, IK Pathan, PP Chawla, S Sreesanth, VRV Singh, U Kaul",AV Jayaprakash,BG Jerling,0,0,0
336014,2008,Hyderabad,11-05-2008,SC Ganguly,"Rajiv Gandhi International Stadium, Uppal",Deccan Chargers,Kolkata Knight Riders,Kolkata Knight Riders,bat,Kolkata Knight Riders,runs,23,,"AC Gilchrist, HH Gibbs, DB Ravi Teja, RG Sharma, SB Styris, Y Venugopal Rao, SB Bangar, WPUJC Vaas, RP Singh, DP Vijaykumar, PP Ojha, Salman Butt, A Chopra, SC Ganguly, DJ Hussey, T Taibu, LR Shukla, WP Saha, Umar Gul, I Sharma, AB Dinda, M Kartik",IL Howell,AM Saheba,0,0,0
336015,2008,Jaipur,11-05-2008,SR Watson,Sawai Mansingh Stadium,Rajasthan Royals,Delhi Daredevils,Rajasthan Royals,field,Rajasthan Royals,wickets,3,,"YK Pathan, GC Smith, M Kaif, SR Watson, RA Jadeja, AD Mascarenhas, SK Warne, NK Patel, M Rawat, SK Trivedi, MM Patel, G Gambhir, V Sehwag, S Dhawan, AB de Villiers, KD Karthik, TM Dilshan, A Mishra, MF Maharoof, VY Mahesh, GD McGrath, PJ Sangwan",SJ Davis,RE Koertzen,0,0,0
336016,2008,Chandigarh,12-05-2008,SE Marsh,"Punjab Cricket Association Stadium, Mohali",Kings XI Punjab,Royal Challengers Bangalore,Royal Challengers Bangalore,bat,Kings XI Punjab,wickets,9,,"SE Marsh, JR Hopes, LA Pomersbach, Yuvraj Singh, DPMD Jayawardene, IK Pathan, TM Srivastava, PP Chawla, U Kaul, S Sreesanth, VRV Singh, J Arunkumar, V Kohli, Misbah-ul-Haq, CL White, R Dravid, MV Boucher, P Kumar, R Vinay Kumar, Z Khan, A Kumble, DW Steyn",BR Doctrove,I Shivram,0,0,0
336017,2008,Kolkata,13-05-2008,Shoaib Akhtar,Eden Gardens,Kolkata Knight Riders,Delhi Daredevils,Kolkata Knight Riders,bat,Kolkata Knight Riders,runs,23,,"Salman Butt, A Chopra, SC Ganguly, DJ Hussey, T Taibu, LR Shukla, WP Saha, Iqbal Abdulla, I Sharma, AB Dinda, Shoaib Akhtar, G Gambhir, V Sehwag, AB de Villiers, MK Tiwary, S Dhawan, TM Dilshan, A Mishra, MF Maharoof, VY Mahesh, PJ Sangwan, GD McGrath",Asad Rauf,IL Howell,0,0,0
336018,2008,Mumbai,14-05-2008,ST Jayasuriya,Wankhede Stadium,Mumbai Indians,Chennai Super Kings,Mumbai Indians,field,Mumbai Indians,wickets,9,,"ST Jayasuriya, SR Tendulkar, RV Uthappa, DJ Thornely, DJ Bravo, AM Nayar, SM Pollock, YV Takawale, RR Raje, A Nehra, DS Kulkarni, S Vidyut, SP Fleming, SK Raina, S Badrinath, CK Kapugedera, MS Dhoni, JA Morkel, Joginder Sharma, MS Gony, L Balaji, M Muralitharan",BR Doctrove,AM Saheba,0,0,0
336019,2008,Chandigarh,28-05-2008,SE Marsh,"Punjab Cricket Association Stadium, Mohali",Kings XI Punjab,Rajasthan Royals,Rajasthan Royals,field,Kings XI Punjab,runs,41,,"SE Marsh, JR Hopes, Yuvraj Singh, LA Pomersbach, KC Sangakkara, RR Powar, PP Chawla, IK Pathan, VRV Singh, S Sreesanth, WA Mota, M Kaif, NK Patel, Younis Khan, SR Watson, YK Pathan, Kamran Akmal, M Rawat, D Salunkhe, Pankaj Singh, SK Trivedi, MM Patel",SJ Davis,K Hariharan,0,0,0
336020,2008,Delhi,15-05-2008,A Mishra,Feroz Shah Kotla,Delhi Daredevils,Deccan Chargers,Deccan Chargers,field,Delhi Daredevils,runs,12,,"G Gambhir, V Sehwag, S Dhawan, MF Maharoof, TM Dilshan, MK Tiwary, KD Karthik, A Mishra, R Bhatia, GD McGrath, Mohammad Asif, AC Gilchrist, Shahid Afridi, HH Gibbs, RG Sharma, SB Styris, Y Venugopal Rao, DB Ravi Teja, RP Singh, PP Ojha, DP Vijaykumar, PM Sarvesh Kumar",BG Jerling,GA Pratapkumar,0,0,0
336021,2008,Mumbai,16-05-2008,SM Pollock,Wankhede Stadium,Mumbai Indians,Kolkata Knight Riders,Mumbai Indians,field,Mumbai Indians,wickets,8,,"ST Jayasuriya, SR Tendulkar, RV Uthappa, DJ Thornely, DJ Bravo, AM Nayar, SM Pollock, RV Pawar, YV Takawale, RR Raje, A Nehra, Salman Butt, A Chopra, SC Ganguly, DJ Hussey, Mohammad Hafeez, WP Saha, LR Shukla, AB Agarkar, Shoaib Akhtar, I Sharma, AB Dinda",BR Doctrove,DJ Harper,0,0,0
336022,2008,Delhi,17-05-2008,DPMD Jayawardene,Feroz Shah Kotla,Delhi Daredevils,Kings XI Punjab,Delhi Daredevils,bat,Kings XI Punjab,runs,6,D/L,"G Gambhir, V Sehwag, S Dhawan, TM Dilshan, MF Maharoof, Shoaib Malik, PJ Sangwan, KD Karthik, A Mishra, R Bhatia, GD McGrath, SE Marsh, JR Hopes, Yuvraj Singh, LA Pomersbach, DPMD Jayawardene, IK Pathan, RR Powar, PP Chawla, U Kaul, S Sreesanth, VRV Singh",AV Jayaprakash,RE Koertzen,0,0,0
336023,2008,Jaipur,17-05-2008,GC Smith,Sawai Mansingh Stadium,Rajasthan Royals,Royal Challengers Bangalore,Royal Challengers Bangalore,field,Rajasthan Royals,runs,65,,"GC Smith, SA Asnodkar, SR Watson, YK Pathan, M Kaif, RA Jadeja, SK Warne, Sohail Tanvir, M Rawat, SK Trivedi, MM Patel, J Arunkumar, V Kohli, Misbah-ul-Haq, JH Kallis, CL White, R Dravid, DT Patil, P Kumar, Z Khan, A Kumble, Abdur Razzak",BF Bowden,SL Shastri,0,0,0
336024,2008,Hyderabad,18-05-2008,DJ Bravo,"Rajiv Gandhi International Stadium, Uppal",Deccan Chargers,Mumbai Indians,Deccan Chargers,field,Mumbai Indians,runs,25,,"AC Gilchrist, Shahid Afridi, RG Sharma, LPC Silva, Y Venugopal Rao, DB Ravi Teja, DNT Zoysa, H Das, RP Singh, PP Ojha, DP Vijaykumar, ST Jayasuriya, SR Tendulkar, DJ Thornely, AM Nayar, RV Uthappa, DJ Bravo, PR Shah, YV Takawale, RR Raje, A Nehra, CRD Fernando",BR Doctrove,DJ Harper,0,0,0
336025,2008,Kolkata,18-05-2008,M Ntini,Eden Gardens,Kolkata Knight Riders,Chennai Super Kings,Kolkata Knight Riders,bat,Chennai Super Kings,runs,3,D/L,"Salman Butt, Mohammad Hafeez, SC Ganguly, DB Das, DJ Hussey, LR Shukla, WP Saha, AB Agarkar, I Sharma, AB Dinda, Shoaib Akhtar, PA Patel, SP Fleming, S Vidyut, SK Raina, S Badrinath, MS Dhoni, JA Morkel, MS Gony, L Balaji, M Muralitharan, M Ntini",Asad Rauf,K Hariharan,0,0,0
336026,2008,Bangalore,19-05-2008,SP Goswami,M Chinnaswamy Stadium,Royal Challengers Bangalore,Delhi Daredevils,Delhi Daredevils,field,Delhi Daredevils,wickets,5,,"JH Kallis, B Chipli, SP Goswami, R Dravid, Misbah-ul-Haq, CL White, B Akhil, P Kumar, Z Khan, A Kumble, DW Steyn, G Gambhir, V Sehwag, AB de Villiers, TM Dilshan, S Dhawan, KD Karthik, MF Maharoof, R Bhatia, VY Mahesh, PJ Sangwan, GD McGrath",SJ Davis,GA Pratapkumar,0,0,0
336027,2008,Kolkata,20-05-2008,YK Pathan,Eden Gardens,Kolkata Knight Riders,Rajasthan Royals,Rajasthan Royals,field,Rajasthan Royals,wickets,6,,"Salman Butt, Mohammad Hafeez, SC Ganguly, DJ Hussey, DB Das, LR Shukla, WP Saha, AB Agarkar, Umar Gul, I Sharma, AB Dinda, GC Smith, SA Asnodkar, Sohail Tanvir, M Kaif, SR Watson, YK Pathan, RA Jadeja, SK Warne, M Rawat, SK Trivedi, MM Patel",BG Jerling,RE Koertzen,0,0,0
336028,2008,Mumbai,21-05-2008,SE Marsh,Wankhede Stadium,Mumbai Indians,Kings XI Punjab,Mumbai Indians,field,Kings XI Punjab,runs,1,,"ST Jayasuriya, SR Tendulkar, DR Smith, AM Nayar, RV Uthappa, SM Pollock, PR Shah, SD Chitnis, CRD Fernando, A Nehra, VS Yeligati, SE Marsh, JR Hopes, LA Pomersbach, Yuvraj Singh, DPMD Jayawardene, IK Pathan, TM Srivastava, PP Chawla, U Kaul, S Sreesanth, VRV Singh",BF Bowden,GA Pratapkumar,0,0,0
336029,2008,Chennai,21-05-2008,A Kumble,"MA Chidambaram Stadium, Chepauk",Chennai Super Kings,Royal Challengers Bangalore,Royal Challengers Bangalore,bat,Royal Challengers Bangalore,runs,14,,"PA Patel, SP Fleming, MS Dhoni, SK Raina, S Badrinath, JA Morkel, S Vidyut, MS Gony, L Balaji, M Ntini, M Muralitharan, JH Kallis, SP Goswami, V Kohli, R Dravid, Misbah-ul-Haq, MV Boucher, B Akhil, P Kumar, R Vinay Kumar, A Kumble, DW Steyn",DJ Harper,I Shivram,0,0,0
336030,2008,Delhi,22-05-2008,,Feroz Shah Kotla,Delhi Daredevils,Kolkata Knight Riders,,,,,,,,Arani Jayaprakash,Brian Jerling,0,0,0
336031,2008,Chandigarh,23-05-2008,SE Marsh,"Punjab Cricket Association Stadium, Mohali",Kings XI Punjab,Deccan Chargers,Kings XI Punjab,field,Kings XI Punjab,wickets,6,,"SE Marsh, KC Sangakkara, Yuvraj Singh, LA Pomersbach, DPMD Jayawardene, PP Chawla, TM Srivastava, RR Powar, Gagandeep Singh, VRV Singh, S Sreesanth, AC Gilchrist, HH Gibbs, RG Sharma, Y Venugopal Rao, LPC Silva, SB Styris, DB Ravi Teja, SB Bangar, RP Singh, PP Ojha, DP Vijaykumar",Asad Rauf,SJ Davis,0,0,0
336032,2008,Delhi,24-05-2008,KD Karthik,Feroz Shah Kotla,Delhi Daredevils,Mumbai Indians,Delhi Daredevils,field,Delhi Daredevils,wickets,5,,"G Gambhir, V Sehwag, S Dhawan, MK Tiwary, TM Dilshan, KD Karthik, MF Maharoof, B Geeves, VY Mahesh, A Mishra, GD McGrath, ST Jayasuriya, SR Tendulkar, DR Smith, RV Uthappa, AM Nayar, SM Pollock, SD Chitnis, PR Shah, A Nel, DS Kulkarni, A Nehra",BF Bowden,K Hariharan,0,0,0
336033,2008,Chennai,24-05-2008,JA Morkel,"MA Chidambaram Stadium, Chepauk",Chennai Super Kings,Rajasthan Royals,Rajasthan Royals,bat,Rajasthan Royals,runs,10,,"PA Patel, SP Fleming, SK Raina, JA Morkel, MS Dhoni, S Badrinath, MS Gony, A Mukund, L Balaji, M Muralitharan, M Ntini, GC Smith, SA Asnodkar, Kamran Akmal, YK Pathan, M Kaif, T Kohli, D Salunkhe, SK Warne, Sohail Tanvir, Pankaj Singh, MM Patel",DJ Harper,SL Shastri,0,0,0
336034,2008,Bangalore,03-05-2008,P Kumar,M Chinnaswamy Stadium,Royal Challengers Bangalore,Deccan Chargers,Deccan Chargers,field,Royal Challengers Bangalore,runs,3,,"B Chipli, W Jaffer, V Kohli, JH Kallis, Misbah-ul-Haq, R Dravid, MV Boucher, P Kumar, Z Khan, DW Steyn, A Kumble, AC Gilchrist, VVS Laxman, HH Gibbs, RG Sharma, Shahid Afridi, SB Styris, AS Yadav, SB Bangar, RP Singh, DP Vijaykumar, PP Ojha",BR Doctrove,SL Shastri,0,0,0
336035,2008,Kolkata,25-05-2008,Umar Gul,Eden Gardens,Kolkata Knight Riders,Kings XI Punjab,Kings XI Punjab,bat,Kolkata Knight Riders,wickets,3,,"Salman Butt, SC Ganguly, DB Das, DJ Hussey, LR Shukla, WP Saha, A Chopra, Umar Gul, I Sharma, BAW Mendis, AB Dinda, SE Marsh, JR Hopes, KC Sangakkara, Yuvraj Singh, DPMD Jayawardene, IK Pathan, PP Chawla, TM Srivastava, RR Powar, VRV Singh, S Sreesanth",SJ Davis,I Shivram,0,0,0
336036,2008,Jaipur,26-05-2008,Sohail Tanvir,Sawai Mansingh Stadium,Rajasthan Royals,Mumbai Indians,Rajasthan Royals,field,Rajasthan Royals,wickets,5,,"Kamran Akmal, SA Asnodkar, YK Pathan, SR Watson, M Kaif, RA Jadeja, NK Patel, SK Warne, Sohail Tanvir, SK Trivedi, Pankaj Singh, ST Jayasuriya, SR Tendulkar, AM Nayar, RV Uthappa, DR Smith, SM Pollock, MK Pandey, YV Takawale, RR Raje, CRD Fernando, A Nehra",BF Bowden,K Hariharan,0,0,0
336037,2008,Hyderabad,27-05-2008,SK Raina,"Rajiv Gandhi International Stadium, Uppal",Deccan Chargers,Chennai Super Kings,Deccan Chargers,bat,Chennai Super Kings,wickets,7,,"AC Gilchrist, HH Gibbs, SB Styris, Y Venugopal Rao, DB Ravi Teja, Shahid Afridi, AS Yadav, RP Singh, PP Ojha, PM Sarvesh Kumar, DP Vijaykumar, PA Patel, SP Fleming, SK Raina, MS Dhoni, JA Morkel, S Badrinath, A Mukund, M Ntini, M Muralitharan, MS Gony, L Balaji",BG Jerling,AM Saheba,0,0,0
336038,2008,Mumbai,30-05-2008,SR Watson,Wankhede Stadium,Delhi Daredevils,Rajasthan Royals,Delhi Daredevils,field,Rajasthan Royals,runs,105,,"G Gambhir, V Sehwag, S Dhawan, MK Tiwary, TM Dilshan, KD Karthik, MF Maharoof, A Mishra, VY Mahesh, Mohammad Asif, GD McGrath, GC Smith, SA Asnodkar, Sohail Tanvir, SR Watson, M Kaif, YK Pathan, RA Jadeja, SK Warne, M Rawat, MM Patel, SK Trivedi",BF Bowden,RE Koertzen,1,1,0
336039,2008,Mumbai,31-05-2008,M Ntini,Wankhede Stadium,Chennai Super Kings,Kings XI Punjab,Kings XI Punjab,bat,Chennai Super Kings,wickets,9,,"PA Patel, S Vidyut, SK Raina, MS Dhoni, CK Kapugedera, S Badrinath, JA Morkel, MS Gony, L Balaji, M Muralitharan, M Ntini, SE Marsh, JR Hopes, KC Sangakkara, Yuvraj Singh, DPMD Jayawardene, IK Pathan, WA Mota, PP Chawla, RR Powar, S Sreesanth, VRV Singh",Asad Rauf,DJ Harper,1,1,0
336040,2008,Mumbai,01-06-2008,YK Pathan,Dr DY Patil Sports Academy,Chennai Super Kings,Rajasthan Royals,Rajasthan Royals,field,Rajasthan Royals,wickets,3,,"PA Patel, S Vidyut, SK Raina, JA Morkel, MS Dhoni, CK Kapugedera, S Badrinath, MS Gony, L Balaji, M Muralitharan, M Ntini, NK Patel, SA Asnodkar, Kamran Akmal, SR Watson, YK Pathan, M Kaif, RA Jadeja, SK Warne, Sohail Tanvir, SK Trivedi, MM Patel",BF Bowden,RE Koertzen,1,1,1
