match_id,year,city,date,player_of_match,venue,team1,team2,toss_winner,toss_decision,winner,result,result_margin,method,players,umpire1,umpire2,playoff,knockout,final
1136565,2018,Chennai,10-04-2018,SW Billings,MA Chidambaram Stadium,Kolkata Knight Riders,Chennai Super Kings,Chennai Super Kings,field,Chennai Super Kings,wickets,5,,"CA Lynn, SP Narine, RV Uthappa, N Rana, KD Karthik, RK Singh, AD Russell, TK Curran, R Vinay Kumar, Kuldeep Yadav, PP Chawla, SR Watson, AT Rayudu, SK Raina, MS Dhoni, SW Billings, RA Jadeja, DJ Bravo, DL Chahar, Harbhajan Singh, SN Thakur, Imran Tahir",AK Chaudhary,CB Gaffaney,0,0,0
1136566,2018,Jaipur,11-04-2018,SV Samson,Sawai Mansingh Stadium,Rajasthan Royals,Delhi Daredevils,Delhi Daredevils,field,Rajasthan Royals,runs,10,D/L,"AM Rahane, DJM Short, BA Stokes, SV Samson, JC Buttler, RA Tripathi, K Gowtham, S Gopal, DS Kulkarni, JD Unadkat, B Laughlin, GJ Maxwell, C Munro, RR Pant, CH Morris, V Shankar, SS Iyer, G Gambhir, R Tewatia, S Nadeem, TA Boult, Mohammed Shami",KN Ananthapadmanabhan,Nitin Menon,0,0,0
1136567,2018,Hyderabad,12-04-2018,Rashid Khan,Rajiv Gandhi International Stadium,Mumbai Indians,Sunrisers Hyderabad,Sunrisers Hyderabad,field,Sunrisers Hyderabad,wickets,1,,"RG Sharma, E Lewis, Ishan Kishan, SA Yadav, KH Pandya, KA Pollard, BCJ Cutting, PJ Sangwan, M Markande, JJ Bumrah, Mustafizur Rahman, WP Saha, S Dhawan, KS Williamson, MK Pandey, Shakib Al Hasan, DJ Hooda, YK Pathan, Rashid Khan, S Kaul, Sandeep Sharma, B Stanlake",CK Nandan,NJ Llong,0,0,0
1136568,2018,Bengaluru,13-04-2018,UT Yadav,M.Chinnaswamy Stadium,Kings XI Punjab,Royal Challengers Bangalore,Royal Challengers Bangalore,field,Royal Challengers Bangalore,wickets,4,,"KL Rahul, MA Agarwal, AJ Finch, Yuvraj Singh, KK Nair, MP Stoinis, AR Patel, R Ashwin, AJ Tye, MM Sharma, Mujeeb Ur Rahman, Q de Kock, BB McCullum, V Kohli, AB de Villiers, SN Khan, Mandeep Singh, CR Woakes, Washington Sundar, UT Yadav, K Khejroliya, YS Chahal",A Deshmukh,S Ravi,0,0,0
1136569,2018,Mumbai,14-04-2018,JJ Roy,Wankhede Stadium,Mumbai Indians,Delhi Daredevils,Delhi Daredevils,field,Delhi Daredevils,wickets,7,,"SA Yadav, E Lewis, Ishan Kishan, RG Sharma, KA Pollard, KH Pandya, HH Pandya, A Dananjaya, M Markande, JJ Bumrah, Mustafizur Rahman, JJ Roy, G Gambhir, RR Pant, GJ Maxwell, SS Iyer, V Shankar, DT Christian, R Tewatia, S Nadeem, Mohammed Shami, TA Boult",KN Ananthapadmanabhan,Nitin Menon,0,0,0
1136570,2018,Kolkata,14-04-2018,B Stanlake,Eden Gardens,Kolkata Knight Riders,Sunrisers Hyderabad,Sunrisers Hyderabad,field,Sunrisers Hyderabad,wickets,5,,"RV Uthappa, CA Lynn, N Rana, SP Narine, KD Karthik, AD Russell, Shubman Gill, Shivam Mavi, MG Johnson, PP Chawla, Kuldeep Yadav, WP Saha, S Dhawan, KS Williamson, MK Pandey, Shakib Al Hasan, DJ Hooda, YK Pathan, B Kumar, Rashid Khan, S Kaul, B Stanlake",AK Chaudhary,A Nand Kishore,0,0,0
1136571,2018,Bengaluru,15-04-2018,SV Samson,M.Chinnaswamy Stadium,Rajasthan Royals,Royal Challengers Bangalore,Royal Challengers Bangalore,field,Rajasthan Royals,runs,19,,"AM Rahane, DJM Short, SV Samson, BA Stokes, JC Buttler, RA Tripathi, K Gowtham, S Gopal, DS Kulkarni, JD Unadkat, B Laughlin, BB McCullum, Q de Kock, V Kohli, AB de Villiers, Mandeep Singh, P Negi, Washington Sundar, CR Woakes, UT Yadav, K Khejroliya, YS Chahal",C Shamshuddin,S Ravi,0,0,0
1136572,2018,Chandigarh,15-04-2018,CH Gayle,Punjab Cricket Association IS Bindra Stadium,Kings XI Punjab,Chennai Super Kings,Chennai Super Kings,field,Kings XI Punjab,runs,4,,"KL Rahul, CH Gayle, MA Agarwal, Yuvraj Singh, AJ Finch, KK Nair, R Ashwin, AJ Tye, BB Sran, MM Sharma, Mujeeb Ur Rahman, SR Watson, M Vijay, AT Rayudu, SW Billings, MS Dhoni, RA Jadeja, DJ Bravo, DL Chahar, Harbhajan Singh, SN Thakur, Imran Tahir",CK Nandan,VA Kulkarni,0,0,0
1136573,2018,Kolkata,16-04-2018,N Rana,Eden Gardens,Kolkata Knight Riders,Delhi Daredevils,Delhi Daredevils,field,Kolkata Knight Riders,runs,71,,"CA Lynn, SP Narine, RV Uthappa, N Rana, KD Karthik, AD Russell, Shubman Gill, TK Curran, PP Chawla, Shivam Mavi, Kuldeep Yadav, G Gambhir, JJ Roy, SS Iyer, RR Pant, GJ Maxwell, R Tewatia, V Shankar, CH Morris, Mohammed Shami, S Nadeem, TA Boult",AK Chaudhary,A Nand Kishore,0,0,0
1136574,2018,Mumbai,17-04-2018,RG Sharma,Wankhede Stadium,Mumbai Indians,Royal Challengers Bangalore,Royal Challengers Bangalore,field,Mumbai Indians,runs,46,,"SA Yadav, E Lewis, Ishan Kishan, RG Sharma, KH Pandya, KA Pollard, HH Pandya, MJ McClenaghan, M Markande, JJ Bumrah, Mustafizur Rahman, V Kohli, Q de Kock, AB de Villiers, Mandeep Singh, CJ Anderson, Washington Sundar, SN Khan, CR Woakes, UT Yadav, Mohammed Siraj, YS Chahal",Nitin Menon,RJ Tucker,0,0,0
1136575,2018,Jaipur,18-04-2018,N Rana,Sawai Mansingh Stadium,Rajasthan Royals,Kolkata Knight Riders,Kolkata Knight Riders,field,Kolkata Knight Riders,wickets,7,,"AM Rahane, DJM Short, SV Samson, RA Tripathi, BA Stokes, JC Buttler, K Gowtham, S Gopal, DS Kulkarni, JD Unadkat, B Laughlin, SP Narine, CA Lynn, RV Uthappa, N Rana, KD Karthik, AD Russell, Shubman Gill, TK Curran, PP Chawla, Shivam Mavi, Kuldeep Yadav",A Deshmukh,S Ravi,0,0,0
1136576,2018,Chandigarh,19-04-2018,CH Gayle,Punjab Cricket Association IS Bindra Stadium,Kings XI Punjab,Sunrisers Hyderabad,Kings XI Punjab,bat,Kings XI Punjab,runs,15,,"KL Rahul, CH Gayle, MA Agarwal, KK Nair, AJ Finch, Yuvraj Singh, R Ashwin, AJ Tye, BB Sran, MM Sharma, Mujeeb Ur Rahman, WP Saha, S Dhawan, KS Williamson, YK Pathan, MK Pandey, DJ Hooda, Shakib Al Hasan, CJ Jordan, B Kumar, Rashid Khan, S Kaul",AK Chaudhary,NJ Llong,0,0,0
1136577,2018,Pune,20-04-2018,SR Watson,Maharashtra Cricket Association Stadium,Chennai Super Kings,Rajasthan Royals,Rajasthan Royals,field,Chennai Super Kings,runs,64,,"SR Watson, AT Rayudu, SK Raina, MS Dhoni, SW Billings, DJ Bravo, RA Jadeja, DL Chahar, KV Sharma, SN Thakur, Imran Tahir, AM Rahane, H Klaasen, SV Samson, BA Stokes, JC Buttler, RA Tripathi, STR Binny, K Gowtham, S Gopal, JD Unadkat, B Laughlin",KN Ananthapadmanabhan,Nitin Menon,0,0,0
1136578,2018,Kolkata,21-04-2018,KL Rahul,Eden Gardens,Kolkata Knight Riders,Kings XI Punjab,Kings XI Punjab,field,Kings XI Punjab,wickets,9,D/L,"CA Lynn, SP Narine, RV Uthappa, N Rana, KD Karthik, AD Russell, Shubman Gill, TK Curran, PP Chawla, Shivam Mavi, Kuldeep Yadav, KL Rahul, CH Gayle, MA Agarwal, KK Nair, AJ Finch, Yuvraj Singh, R Ashwin, AJ Tye, BB Sran, Mujeeb Ur Rahman, AS Rajpoot",A Deshmukh,C Shamshuddin,0,0,0
1136579,2018,Bengaluru,21-04-2018,AB de Villiers,M.Chinnaswamy Stadium,Delhi Daredevils,Royal Challengers Bangalore,Royal Challengers Bangalore,field,Royal Challengers Bangalore,wickets,6,,"JJ Roy, G Gambhir, SS Iyer, RR Pant, GJ Maxwell, R Tewatia, CH Morris, V Shankar, S Nadeem, HV Patel, TA Boult, Q de Kock, M Vohra, V Kohli, AB de Villiers, CJ Anderson, Mandeep Singh, Washington Sundar, CR Woakes, UT Yadav, Mohammed Siraj, YS Chahal",CB Gaffaney,CK Nandan,0,0,0
1136580,2018,Hyderabad,22-04-2018,AT Rayudu,Rajiv Gandhi International Stadium,Chennai Super Kings,Sunrisers Hyderabad,Sunrisers Hyderabad,field,Chennai Super Kings,runs,4,,"SR Watson, F du Plessis, SK Raina, AT Rayudu, MS Dhoni, SW Billings, DJ Bravo, RA Jadeja, DL Chahar, KV Sharma, SN Thakur, RK Bhui, KS Williamson, MK Pandey, DJ Hooda, Shakib Al Hasan, YK Pathan, WP Saha, Rashid Khan, B Kumar, B Stanlake, S Kaul",AK Chaudhary,VA Kulkarni,0,0,0
1136581,2018,Jaipur,22-04-2018,JC Archer,Sawai Mansingh Stadium,Mumbai Indians,Rajasthan Royals,Mumbai Indians,bat,Rajasthan Royals,wickets,3,,"SA Yadav, E Lewis, Ishan Kishan, KA Pollard, RG Sharma, KH Pandya, HH Pandya, MJ McClenaghan, M Markande, JJ Bumrah, Mustafizur Rahman, AM Rahane, RA Tripathi, SV Samson, BA Stokes, JC Buttler, H Klaasen, JC Archer, K Gowtham, JD Unadkat, DS Kulkarni, S Gopal",KN Ananthapadmanabhan,RJ Tucker,0,0,0
1136582,2018,Delhi,23-04-2018,AS Rajpoot,Arun Jaitley Stadium,Kings XI Punjab,Delhi Daredevils,Delhi Daredevils,field,Kings XI Punjab,runs,4,,"KL Rahul, AJ Finch, MA Agarwal, KK Nair, Yuvraj Singh, DA Miller, R Ashwin, AJ Tye, BB Sran, AS Rajpoot, Mujeeb Ur Rahman, PP Shaw, G Gambhir, GJ Maxwell, SS Iyer, RR Pant, DT Christian, R Tewatia, LE Plunkett, A Mishra, Avesh Khan, TA Boult",A Nand Kishore,CK Nandan,0,0,0
1136583,2018,Mumbai,24-04-2018,Rashid Khan,Wankhede Stadium,Sunrisers Hyderabad,Mumbai Indians,Mumbai Indians,field,Sunrisers Hyderabad,runs,31,,"S Dhawan, KS Williamson, WP Saha, MK Pandey, Shakib Al Hasan, YK Pathan, Mohammad Nabi, Rashid Khan, Basil Thampi, S Kaul, Sandeep Sharma, SA Yadav, E Lewis, Ishan Kishan, RG Sharma, KH Pandya, KA Pollard, HH Pandya, MJ McClenaghan, M Markande, JJ Bumrah, Mustafizur Rahman",C Shamshuddin,S Ravi,0,0,0
1136584,2018,Bengaluru,25-04-2018,MS Dhoni,M.Chinnaswamy Stadium,Royal Challengers Bangalore,Chennai Super Kings,Chennai Super Kings,field,Chennai Super Kings,wickets,5,,"Q de Kock, V Kohli, AB de Villiers, CJ Anderson, Mandeep Singh, C de Grandhomme, P Negi, Washington Sundar, UT Yadav, Mohammed Siraj, YS Chahal, SR Watson, AT Rayudu, SK Raina, SW Billings, RA Jadeja, MS Dhoni, DJ Bravo, Harbhajan Singh, DL Chahar, SN Thakur, Imran Tahir",NJ Llong,VK Sharma,0,0,0
1136585,2018,Hyderabad,26-04-2018,AS Rajpoot,Rajiv Gandhi International Stadium,Sunrisers Hyderabad,Kings XI Punjab,Kings XI Punjab,field,Sunrisers Hyderabad,runs,13,,"S Dhawan, KS Williamson, WP Saha, MK Pandey, Shakib Al Hasan, YK Pathan, Mohammad Nabi, Rashid Khan, Basil Thampi, S Kaul, Sandeep Sharma, KL Rahul, CH Gayle, MA Agarwal, KK Nair, AJ Finch, MK Tiwary, R Ashwin, AJ Tye, BB Sran, AS Rajpoot, Mujeeb Ur Rahman",CK Nandan,YC Barde,0,0,0
1136586,2018,Delhi,27-04-2018,SS Iyer,Arun Jaitley Stadium,Delhi Daredevils,Kolkata Knight Riders,Kolkata Knight Riders,field,Delhi Daredevils,runs,55,,"PP Shaw, C Munro, SS Iyer, RR Pant, GJ Maxwell, V Shankar, R Tewatia, LE Plunkett, A Mishra, Avesh Khan, TA Boult, CA Lynn, SP Narine, RV Uthappa, N Rana, KD Karthik, Shubman Gill, AD Russell, Shivam Mavi, PP Chawla, MG Johnson, Kuldeep Yadav",C Shamshuddin,S Ravi,0,0,0
1136587,2018,Pune,28-04-2018,RG Sharma,Maharashtra Cricket Association Stadium,Chennai Super Kings,Mumbai Indians,Mumbai Indians,field,Mumbai Indians,wickets,8,,"SR Watson, AT Rayudu, SK Raina, MS Dhoni, DJ Bravo, SW Billings, RA Jadeja, Harbhajan Singh, DL Chahar, SN Thakur, Imran Tahir, SA Yadav, E Lewis, RG Sharma, HH Pandya, Ishan Kishan, JP Duminy, KH Pandya, BCJ Cutting, MJ McClenaghan, M Markande, JJ Bumrah",CB Gaffaney,Nitin Menon,0,0,0
1136588,2018,Jaipur,29-04-2018,KS Williamson,Sawai Mansingh Stadium,Sunrisers Hyderabad,Rajasthan Royals,Sunrisers Hyderabad,bat,Sunrisers Hyderabad,runs,11,,"AD Hales, S Dhawan, KS Williamson, MK Pandey, Shakib Al Hasan, YK Pathan, WP Saha, Rashid Khan, Basil Thampi, Sandeep Sharma, S Kaul, AM Rahane, RA Tripathi, SV Samson, BA Stokes, JC Buttler, MK Lomror, K Gowtham, JC Archer, DS Kulkarni, IS Sodhi, JD Unadkat",BNJ Oxenford,A Nand Kishore,0,0,0
1136589,2018,Bengaluru,29-04-2018,CA Lynn,M.Chinnaswamy Stadium,Royal Challengers Bangalore,Kolkata Knight Riders,Kolkata Knight Riders,field,Kolkata Knight Riders,wickets,6,,"Q de Kock, BB McCullum, V Kohli, M Vohra, Mandeep Singh, C de Grandhomme, M Ashwin, TG Southee, UT Yadav, YS Chahal, Mohammed Siraj, CA Lynn, SP Narine, RV Uthappa, N Rana, AD Russell, KD Karthik, Shubman Gill, Shivam Mavi, PP Chawla, MG Johnson, Kuldeep Yadav",AK Chaudhary,NJ Llong,0,0,0
1136590,2018,Pune,30-04-2018,SR Watson,Maharashtra Cricket Association Stadium,Chennai Super Kings,Delhi Daredevils,Delhi Daredevils,field,Chennai Super Kings,runs,13,,"SR Watson, F du Plessis, SK Raina, AT Rayudu, MS Dhoni, RA Jadeja, DJ Bravo, KV Sharma, Harbhajan Singh, KM Asif, L Ngidi, PP Shaw, C Munro, SS Iyer, RR Pant, GJ Maxwell, V Shankar, R Tewatia, LE Plunkett, A Mishra, Avesh Khan, TA Boult",AY Dandekar,C Shamshuddin,0,0,0
1136591,2018,Bengaluru,01-05-2018,TG Southee,M.Chinnaswamy Stadium,Royal Challengers Bangalore,Mumbai Indians,Mumbai Indians,field,Royal Challengers Bangalore,runs,14,,"M Vohra, Q de Kock, BB McCullum, V Kohli, Mandeep Singh, C de Grandhomme, Washington Sundar, TG Southee, UT Yadav, YS Chahal, Mohammed Siraj, SA Yadav, Ishan Kishan, JP Duminy, RG Sharma, KA Pollard, HH Pandya, KH Pandya, BCJ Cutting, MJ McClenaghan, M Markande, JJ Bumrah",M Erasmus,Nitin Menon,0,0,0
1136592,2018,Delhi,02-05-2018,RR Pant,Arun Jaitley Stadium,Delhi Daredevils,Rajasthan Royals,Rajasthan Royals,field,Delhi Daredevils,runs,4,D/L,"PP Shaw, C Munro, SS Iyer, RR Pant, GJ Maxwell, V Shankar, LE Plunkett, A Mishra, S Nadeem, Avesh Khan, TA Boult, DJM Short, JC Buttler, SV Samson, BA Stokes, RA Tripathi, K Gowtham, JC Archer, AM Rahane, JD Unadkat, DS Kulkarni, S Gopal",CK Nandan,VK Sharma,0,0,0
1136593,2018,Kolkata,03-05-2018,SP Narine,Eden Gardens,Chennai Super Kings,Kolkata Knight Riders,Kolkata Knight Riders,field,Kolkata Knight Riders,wickets,6,,"SR Watson, F du Plessis, SK Raina, AT Rayudu, MS Dhoni, RA Jadeja, KV Sharma, DJ Bravo, Harbhajan Singh, KM Asif, L Ngidi, CA Lynn, SP Narine, RV Uthappa, Shubman Gill, RK Singh, KD Karthik, AD Russell, Shivam Mavi, PP Chawla, MG Johnson, Kuldeep Yadav",A Deshmukh,HDPK Dharmasena,0,0,0
1136594,2018,Indore,04-05-2018,SA Yadav,Holkar Cricket Stadium,Kings XI Punjab,Mumbai Indians,Mumbai Indians,field,Mumbai Indians,wickets,6,,"KL Rahul, CH Gayle, Yuvraj Singh, KK Nair, AR Patel, MP Stoinis, MA Agarwal, R Ashwin, AJ Tye, Mujeeb Ur Rahman, AS Rajpoot, SA Yadav, E Lewis, Ishan Kishan, HH Pandya, RG Sharma, KH Pandya, JP Duminy, BCJ Cutting, MJ McClenaghan, M Markande, JJ Bumrah",AY Dandekar,S Ravi,0,0,0
1136595,2018,Pune,05-05-2018,RA Jadeja,Maharashtra Cricket Association Stadium,Royal Challengers Bangalore,Chennai Super Kings,Chennai Super Kings,field,Chennai Super Kings,wickets,6,,"PA Patel, BB McCullum, V Kohli, AB de Villiers, Mandeep Singh, C de Grandhomme, M Ashwin, TG Southee, UT Yadav, Mohammed Siraj, YS Chahal, SR Watson, AT Rayudu, SK Raina, DR Shorey, MS Dhoni, DJ Bravo, RA Jadeja, DJ Willey, Harbhajan Singh, L Ngidi, SN Thakur",Nitin Menon,YC Barde,0,0,0
1136596,2018,Hyderabad,05-05-2018,Rashid Khan,Rajiv Gandhi International Stadium,Delhi Daredevils,Sunrisers Hyderabad,Delhi Daredevils,bat,Sunrisers Hyderabad,wickets,7,,"PP Shaw, GJ Maxwell, SS Iyer, RR Pant, NV Ojha, V Shankar, DT Christian, LE Plunkett, A Mishra, Avesh Khan, TA Boult, AD Hales, S Dhawan, KS Williamson, MK Pandey, YK Pathan, Shakib Al Hasan, WP Saha, B Kumar, Rashid Khan, S Kaul, Sandeep Sharma",BNJ Oxenford,CK Nandan,0,0,0
1136597,2018,Mumbai,06-05-2018,HH Pandya,Wankhede Stadium,Mumbai Indians,Kolkata Knight Riders,Kolkata Knight Riders,field,Mumbai Indians,runs,13,,"SA Yadav, E Lewis, RG Sharma, HH Pandya, KH Pandya, JP Duminy, Ishan Kishan, BCJ Cutting, MJ McClenaghan, M Markande, JJ Bumrah, CA Lynn, Shubman Gill, RV Uthappa, N Rana, KD Karthik, AD Russell, SP Narine, PP Chawla, MG Johnson, M Prasidh Krishna, Kuldeep Yadav",A Deshmukh,HDPK Dharmasena,0,0,0
1136598,2018,Indore,06-05-2018,Mujeeb Ur Rahman,Holkar Cricket Stadium,Rajasthan Royals,Kings XI Punjab,Kings XI Punjab,field,Kings XI Punjab,wickets,6,,"JC Buttler, DJM Short, AM Rahane, SV Samson, BA Stokes, RA Tripathi, JC Archer, K Gowtham, S Gopal, JD Unadkat, Anureet Singh, KL Rahul, CH Gayle, MA Agarwal, KK Nair, AR Patel, MP Stoinis, MK Tiwary, R Ashwin, Mujeeb Ur Rahman, AS Rajpoot, AJ Tye",C Shamshuddin,S Ravi,0,0,0
1136599,2018,Hyderabad,07-05-2018,KS Williamson,Rajiv Gandhi International Stadium,Sunrisers Hyderabad,Royal Challengers Bangalore,Royal Challengers Bangalore,field,Sunrisers Hyderabad,runs,5,,"AD Hales, S Dhawan, KS Williamson, MK Pandey, Shakib Al Hasan, YK Pathan, WP Saha, Rashid Khan, B Kumar, S Kaul, Sandeep Sharma, M Vohra, PA Patel, V Kohli, AB de Villiers, MM Ali, Mandeep Singh, C de Grandhomme, TG Southee, UT Yadav, Mohammed Siraj, YS Chahal",BNJ Oxenford,VK Sharma,0,0,0
1136600,2018,Jaipur,08-05-2018,JC Buttler,Sawai Mansingh Stadium,Rajasthan Royals,Kings XI Punjab,Rajasthan Royals,bat,Rajasthan Royals,runs,15,,"AM Rahane, JC Buttler, K Gowtham, SV Samson, BA Stokes, STR Binny, MK Lomror, JC Archer, JD Unadkat, IS Sodhi, Anureet Singh, KL Rahul, CH Gayle, R Ashwin, KK Nair, AD Nath, MK Tiwary, AR Patel, MP Stoinis, AJ Tye, MM Sharma, Mujeeb Ur Rahman",M Erasmus,Nitin Menon,0,0,0
1136601,2018,Kolkata,09-05-2018,Ishan Kishan,Eden Gardens,Mumbai Indians,Kolkata Knight Riders,Kolkata Knight Riders,field,Mumbai Indians,runs,102,,"SA Yadav, E Lewis, RG Sharma, Ishan Kishan, HH Pandya, BCJ Cutting, KH Pandya, JP Duminy, MJ McClenaghan, M Markande, JJ Bumrah, SP Narine, CA Lynn, RV Uthappa, N Rana, AD Russell, KD Karthik, RK Singh, TK Curran, PP Chawla, Kuldeep Yadav, M Prasidh Krishna",KN Ananthapadmanabhan,AK Chaudhary,0,0,0
1136602,2018,Delhi,10-05-2018,S Dhawan,Arun Jaitley Stadium,Delhi Daredevils,Sunrisers Hyderabad,Delhi Daredevils,bat,Sunrisers Hyderabad,wickets,9,,"PP Shaw, JJ Roy, SS Iyer, RR Pant, HV Patel, GJ Maxwell, V Shankar, LE Plunkett, S Nadeem, A Mishra, TA Boult, AD Hales, S Dhawan, KS Williamson, MK Pandey, Shakib Al Hasan, YK Pathan, SP Goswami, Rashid Khan, B Kumar, S Kaul, Sandeep Sharma",AY Dandekar,C Shamshuddin,0,0,0
1136603,2018,Jaipur,11-05-2018,JC Buttler,Sawai Mansingh Stadium,Chennai Super Kings,Rajasthan Royals,Chennai Super Kings,bat,Rajasthan Royals,wickets,4,,"SR Watson, AT Rayudu, SK Raina, MS Dhoni, SW Billings, DJ Bravo, RA Jadeja, DJ Willey, Harbhajan Singh, SN Thakur, KV Sharma, JC Buttler, BA Stokes, AM Rahane, SV Samson, P Chopra, STR Binny, K Gowtham, JC Archer, Ankit Sharma, JD Unadkat, IS Sodhi",M Erasmus,YC Barde,0,0,0
1136604,2018,Indore,12-05-2018,SP Narine,Holkar Cricket Stadium,Kolkata Knight Riders,Kings XI Punjab,Kings XI Punjab,field,Kolkata Knight Riders,runs,31,,"CA Lynn, SP Narine, RV Uthappa, AD Russell, KD Karthik, N Rana, Shubman Gill, JPR Scantlebury-Searles, PP Chawla, Kuldeep Yadav, M Prasidh Krishna, KL Rahul, CH Gayle, MA Agarwal, KK Nair, AJ Finch, AR Patel, R Ashwin, AJ Tye, BB Sran, MM Sharma, Mujeeb Ur Rahman",CK Nandan,VK Sharma,0,0,0
1136605,2018,Delhi,12-05-2018,AB de Villiers,Arun Jaitley Stadium,Delhi Daredevils,Royal Challengers Bangalore,Royal Challengers Bangalore,field,Royal Challengers Bangalore,wickets,5,,"PP Shaw, JJ Roy, SS Iyer, RR Pant, V Shankar, Abhishek Sharma, HV Patel, A Mishra, S Lamichhane, CJ Dala, TA Boult, PA Patel, MM Ali, V Kohli, AB de Villiers, Mandeep Singh, SN Khan, C de Grandhomme, TG Southee, UT Yadav, Mohammed Siraj, YS Chahal",KN Ananthapadmanabhan,HDPK Dharmasena,0,0,0
1136606,2018,Pune,13-05-2018,AT Rayudu,Maharashtra Cricket Association Stadium,Sunrisers Hyderabad,Chennai Super Kings,Chennai Super Kings,field,Chennai Super Kings,wickets,8,,"S Dhawan, AD Hales, KS Williamson, MK Pandey, DJ Hooda, Shakib Al Hasan, SP Goswami, Rashid Khan, B Kumar, S Kaul, Sandeep Sharma, SR Watson, AT Rayudu, SK Raina, MS Dhoni, SW Billings, DJ Bravo, RA Jadeja, DJ Willey, Harbhajan Singh, DL Chahar, SN Thakur",M Erasmus,YC Barde,0,0,0
1136607,2018,Mumbai,13-05-2018,JC Buttler,Wankhede Stadium,Mumbai Indians,Rajasthan Royals,Rajasthan Royals,field,Rajasthan Royals,wickets,7,,"SA Yadav, E Lewis, RG Sharma, Ishan Kishan, HH Pandya, KH Pandya, BCJ Cutting, JP Duminy, MJ McClenaghan, M Markande, JJ Bumrah, DJM Short, JC Buttler, AM Rahane, SV Samson, BA Stokes, STR Binny, JC Archer, K Gowtham, S Gopal, JD Unadkat, DS Kulkarni",Nitin Menon,S Ravi,0,0,0
1136608,2018,Indore,14-05-2018,UT Yadav,Holkar Cricket Stadium,Kings XI Punjab,Royal Challengers Bangalore,Royal Challengers Bangalore,field,Royal Challengers Bangalore,wickets,10,,"KL Rahul, CH Gayle, KK Nair, AJ Finch, MP Stoinis, MA Agarwal, AR Patel, R Ashwin, AJ Tye, MM Sharma, AS Rajpoot, V Kohli, PA Patel, MM Ali, AB de Villiers, Mandeep Singh, SN Khan, C de Grandhomme, TG Southee, UT Yadav, Mohammed Siraj, YS Chahal",BNJ Oxenford,VK Sharma,0,0,0
1136609,2018,Kolkata,15-05-2018,Kuldeep Yadav,Eden Gardens,Rajasthan Royals,Kolkata Knight Riders,Kolkata Knight Riders,field,Kolkata Knight Riders,wickets,6,,"RA Tripathi, JC Buttler, AM Rahane, SV Samson, BA Stokes, STR Binny, K Gowtham, JD Unadkat, IS Sodhi, JC Archer, Anureet Singh, SP Narine, CA Lynn, RV Uthappa, N Rana, KD Karthik, AD Russell, Shubman Gill, Shivam Mavi, JPR Scantlebury-Searles, Kuldeep Yadav, M Prasidh Krishna",AK Chaudhary,HDPK Dharmasena,0,0,0
1136610,2018,Mumbai,16-05-2018,JJ Bumrah,Wankhede Stadium,Mumbai Indians,Kings XI Punjab,Kings XI Punjab,field,Mumbai Indians,runs,3,,"SA Yadav, E Lewis, Ishan Kishan, RG Sharma, KH Pandya, KA Pollard, HH Pandya, BCJ Cutting, MJ McClenaghan, M Markande, JJ Bumrah, KL Rahul, CH Gayle, AJ Finch, MP Stoinis, AR Patel, Yuvraj Singh, MK Tiwary, R Ashwin, AJ Tye, MM Sharma, AS Rajpoot",M Erasmus,Nitin Menon,0,0,0
1136611,2018,Bengaluru,17-05-2018,AB de Villiers,M.Chinnaswamy Stadium,Royal Challengers Bangalore,Sunrisers Hyderabad,Sunrisers Hyderabad,field,Royal Challengers Bangalore,runs,14,,"PA Patel, V Kohli, AB de Villiers, MM Ali, C de Grandhomme, Mandeep Singh, SN Khan, TG Southee, UT Yadav, Mohammed Siraj, YS Chahal, S Dhawan, AD Hales, KS Williamson, MK Pandey, DJ Hooda, Shakib Al Hasan, SP Goswami, Rashid Khan, S Kaul, Sandeep Sharma, Basil Thampi",AY Dandekar,S Ravi,0,0,0
1136612,2018,Delhi,18-05-2018,HV Patel,Arun Jaitley Stadium,Delhi Daredevils,Chennai Super Kings,Chennai Super Kings,field,Delhi Daredevils,runs,34,,"PP Shaw, SS Iyer, RR Pant, GJ Maxwell, V Shankar, Abhishek Sharma, HV Patel, A Mishra, S Lamichhane, TA Boult, Avesh Khan, SR Watson, AT Rayudu, SK Raina, MS Dhoni, SW Billings, RA Jadeja, DJ Bravo, DL Chahar, Harbhajan Singh, SN Thakur, L Ngidi",HDPK Dharmasena,VA Kulkarni,0,0,0
1136613,2018,Jaipur,19-05-2018,S Gopal,Sawai Mansingh Stadium,Rajasthan Royals,Royal Challengers Bangalore,Rajasthan Royals,bat,Rajasthan Royals,runs,30,,"RA Tripathi, JC Archer, AM Rahane, SV Samson, H Klaasen, K Gowtham, STR Binny, S Gopal, IS Sodhi, JD Unadkat, B Laughlin, V Kohli, PA Patel, AB de Villiers, MM Ali, Mandeep Singh, C de Grandhomme, SN Khan, TG Southee, UT Yadav, Mohammed Siraj, YS Chahal",BNJ Oxenford,VK Sharma,0,0,0
1136614,2018,Hyderabad,19-05-2018,CA Lynn,Rajiv Gandhi International Stadium,Sunrisers Hyderabad,Kolkata Knight Riders,Sunrisers Hyderabad,bat,Kolkata Knight Riders,wickets,5,,"S Dhawan, SP Goswami, KS Williamson, MK Pandey, YK Pathan, CR Brathwaite, Shakib Al Hasan, Rashid Khan, B Kumar, S Kaul, Sandeep Sharma, CA Lynn, SP Narine, RV Uthappa, KD Karthik, AD Russell, N Rana, Shubman Gill, PP Chawla, JPR Scantlebury-Searles, Kuldeep Yadav, M Prasidh Krishna",AK Chaudhary,S Ravi,0,0,0
1136615,2018,Delhi,20-05-2018,A Mishra,Arun Jaitley Stadium,Delhi Daredevils,Mumbai Indians,Delhi Daredevils,bat,Delhi Daredevils,runs,11,,"PP Shaw, GJ Maxwell, SS Iyer, RR Pant, V Shankar, Abhishek Sharma, HV Patel, A Mishra, S Lamichhane, TA Boult, LE Plunkett, SA Yadav, E Lewis, Ishan Kishan, KA Pollard, RG Sharma, KH Pandya, HH Pandya, BCJ Cutting, M Markande, JJ Bumrah, Mustafizur Rahman",HDPK Dharmasena,CK Nandan,0,0,0
1136616,2018,Pune,20-05-2018,L Ngidi,Maharashtra Cricket Association Stadium,Kings XI Punjab,Chennai Super Kings,Chennai Super Kings,field,Chennai Super Kings,wickets,5,,"KL Rahul, CH Gayle, AJ Finch, MK Tiwary, DA Miller, KK Nair, AR Patel, R Ashwin, AJ Tye, MM Sharma, AS Rajpoot, AT Rayudu, F du Plessis, SK Raina, SW Billings, Harbhajan Singh, DL Chahar, MS Dhoni, DJ Bravo, RA Jadeja, SN Thakur, L Ngidi",Nitin Menon,YC Barde,0,0,0
1136617,2018,Mumbai,22-05-2018,F du Plessis,Wankhede Stadium,Sunrisers Hyderabad,Chennai Super Kings,Chennai Super Kings,field,Chennai Super Kings,wickets,2,,"S Dhawan, SP Goswami, KS Williamson, MK Pandey, Shakib Al Hasan, YK Pathan, CR Brathwaite, B Kumar, Rashid Khan, S Kaul, Sandeep Sharma, SR Watson, F du Plessis, SK Raina, AT Rayudu, MS Dhoni, DJ Bravo, RA Jadeja, DL Chahar, Harbhajan Singh, SN Thakur, L Ngidi",C Shamshuddin,M Erasmus,1,0,0
1136618,2018,Kolkata,23-05-2018,AD Russell,Eden Gardens,Kolkata Knight Riders,Rajasthan Royals,Rajasthan Royals,field,Kolkata Knight Riders,runs,25,,"SP Narine, CA Lynn, RV Uthappa, N Rana, KD Karthik, Shubman Gill, AD Russell, JPR Scantlebury-Searles, PP Chawla, Kuldeep Yadav, M Prasidh Krishna, AM Rahane, RA Tripathi, SV Samson, H Klaasen, STR Binny, K Gowtham, JC Archer, S Gopal, IS Sodhi, JD Unadkat, B Laughlin",AK Chaudhary,Nitin Menon,1,1,0
1136619,2018,Kolkata,25-05-2018,Rashid Khan,Eden Gardens,Sunrisers Hyderabad,Kolkata Knight Riders,Kolkata Knight Riders,field,Sunrisers Hyderabad,runs,14,,"WP Saha, S Dhawan, KS Williamson, Shakib Al Hasan, DJ Hooda, YK Pathan, CR Brathwaite, Rashid Khan, B Kumar, S Kaul, KK Ahmed, CA Lynn, SP Narine, N Rana, RV Uthappa, KD Karthik, Shubman Gill, AD Russell, PP Chawla, Shivam Mavi, Kuldeep Yadav, M Prasidh Krishna",HDPK Dharmasena,Nitin Menon,1,1,0
1136620,2018,Mumbai,27-05-2018,SR Watson,Wankhede Stadium,Sunrisers Hyderabad,Chennai Super Kings,Chennai Super Kings,field,Chennai Super Kings,wickets,8,,"SP Goswami, S Dhawan, KS Williamson, Shakib Al Hasan, YK Pathan, DJ Hooda, CR Brathwaite, Rashid Khan, B Kumar, S Kaul, Sandeep Sharma, SR Watson, F du Plessis, SK Raina, AT Rayudu, MS Dhoni, DJ Bravo, RA Jadeja, DL Chahar, KV Sharma, SN Thakur, L Ngidi",M Erasmus,S Ravi,1,1,1
1175356,2019,Chennai,23-03-2019,Harbhajan Singh,MA Chidambaram Stadium,Royal Challengers Bangalore,Chennai Super Kings,Chennai Super Kings,field,Chennai Super Kings,wickets,7,,"V Kohli, PA Patel, MM Ali, AB de Villiers, SO Hetmyer, S Dube, C de Grandhomme, Navdeep Saini, YS Chahal, UT Yadav, Mohammed Siraj, SR Watson, AT Rayudu, SK Raina, KM Jadhav, RA Jadeja, MS Dhoni, DJ Bravo, DL Chahar, SN Thakur, Harbhajan Singh, Imran Tahir",AY Dandekar,BNJ Oxenford,0,0,0
